Description,revenue,product_rank
BLUE GLASS CHUNKY CHARM BRACELET,304.3,3689
TURQOISE ICE CREAM SUNHAT,304.09,3690
ANT WHITE HIGH RISE BIRD BOX,304.0,3691
BLUE STAR BLOCK TABLE LAMP,303.85,3692
PILLOWCUSHION COVER PINK UNION JACK,303.45,3693
SET/4 DAISY MIRROR MAGNETS,302.9,3694
4 BURGUNDY WINE DINNER CANDLES,302.69,3695
S/3 FLWR FAIRY SUMMER CANDLES,302.40000000000003,3696
JARDIN ETCHED GLASS CANDLEHLDR LONG,301.95,3697
"PEARL & SHELL 42""NECKL. IVORY",301.0,3698
MEASURING TAPE RUSSIAN DOLL BLUE,300.90000000000003,3699
ENAMEL DOG BOWL CREAM,300.48,3700
ENGLISH ROSE NOTEBOOK A6 SIZE,300.15000000000003,3701
SILVER STANDING GNOME   ,300.0,3702
LA JARDIN BOTANIQUE CUSHION COVER,300.0,3702
ORIENTAL BLUE CUSHION COVER ,299.7,3704
BLUE FLY SWAT,299.46,3705
PAINT YOUR OWN EGGS IN CRATE,299.36,3706
HEAVENS SCENT FRAGRANCE OILS ASSTD,299.34999999999997,3707
TUSCAN VILLA DOVECOTE BIRD FEEDER,299.25,3708
PINK PARTY SUNGLASSES,298.5,3709
HEART BUTTONS JEWELLERY BOX,298.35,3710
NINJA RABBIT BLACK,297.64,3711
SILVER HOOP EARRINGS WITH FLOWER,297.5,3712
CANDY STRIPE ROSE C/COVER ,297.5,3712
VIP HOLIDAY PURSE,296.48,3714
GREEN ROUND COMPACT MIRROR,296.25,3715
OYSTER TRINKET BOX,295.62,3716
SET 5 MINI DOUGHNUT FRIDGE MAGNET ,295.08000000000004,3717
DOLLCRAFT GIRL AMELIE KIT,294.7,3718
FAIRY CAKES ROUND NESTING BOXES,293.8,3719
MAXWELL 2 TONE PINK 60 PAGE PHOTO A,293.0,3720
S/4 FESTIVE RED DINNER CANDLES,292.5,3721
SMALL WHITE/PINK ROSE ART FLOWER,292.03999999999996,3722
SET 72 CAKE CASES VINTAGE CHRISTMAS,291.6,3723
BLUE PUDDING SPOON,291.06,3724
SILVER APERITIF GLASS,290.72,3725
BLACK LOVE BIRD CANDLE,290.24,3726
CURIO CABINET LINEN AND LACE ,290.1,3727
ASS FLORAL PRINT TAPE MEASURE,289.19,3728
PINK MURANO TWIST BRACELET,289.0,3729
WHITE ANEMONE ARTIFICIAL FLOWER,288.99,3730
BATHROOM SCALES RUBBER DUCKS,287.8,3731
PAPER LANTERN 5 POINT SEQUIN STAR,287.5,3732
JADE DROP EARRINGS W FILIGREE,287.1,3733
JASMINE TEA INCENSE IN TIN,286.8,3734
DOILY THANK YOU CARD,286.62,3735
SMALL HANGING GLASS+ZINC LANTERN,285.65,3736
BLUE RETRO KITCHEN WALL CLOCK,285.25,3737
ICON MUG REVOLUTIONARY,283.71,3738
PACK/12 BLUE FOLKART CARDS,283.20000000000005,3739
SET/6  ANGEL T-LIGHTS WHITE/GOLD,282.96999999999997,3740
MINI JIGSAW FIDO,282.24,3741
RED AND WHITE SPOT TAPE,282.1,3742
GREEN BITTY LIGHT CHAIN,281.31,3743
RED  EGG  SPOON,280.98,3744
AMBER GLASS/SILVER BRACELET,279.95,3745
BLCK NEW BAROQUE CANDLESTICK CANDLE,279.0,3746
PURPLE/TURQ FLOWERS HANDBAG,278.75,3747
SILVER/MOP ORBIT NECKLACE,278.59999999999997,3748
SPACE FROG,278.5,3749
QUEEN OF THE SKIES HOLIDAY PURSE ,277.19,3750
ASS COL CIRCLE MOBILE ,276.96,3751
SNACK TRAY I LOVE LONDON,276.15,3752
GREEN KASHMIRI BOXED MIRROR,276.0,3753
FUNKY MONKEY CUSHION COVER,275.4,3754
FOUR RABBIT EASTER DECORATIONS,275.25,3755
WIRE FLOWER T-LIGHT HOLDER,275.0,3756
SMOKEY GREY COLOUR D.O.F. GLASS,274.99,3757
PINK FLY SWAT,274.01,3758
PINK STRING CURTAIN WITH POLE,273.35,3759
SPACE CADET RED,272.37,3760
MEDIUM PINK BUDDHA HEAD ,271.40000000000003,3761
ASSORTED COLOUR METAL CAT ,271.1,3762
MIDNIGHT BLUE GLASS/SILVER BRACELET,271.0,3763
BEADED CRYSTAL HEART PINK ON STICK,270.94,3764
"FLOWER GLASS GARLAND NECKL.36""BLACK",270.3,3765
BLUE  VOILE LAMPSHADE,269.90000000000003,3766
BLACK BOX MIRROR LANTERN,268.75,3767
PURPLE ENAMEL FLOWER RING,268.45000000000005,3768
JUMBO BAG VINTAGE DOILEY ,268.44,3769
MOCK LOBSTER FRIDGE MAGNET,268.34,3770
PINK/BLUE STRING CURTAIN ,268.25,3771
S/4 BLACK MINI ROSE CANDLE IN BOWL,267.96999999999997,3772
DIAMANTE BOW BROOCH GREEN COLOUR,266.7,3773
PASTEL PINK PHOTO ALBUM ,266.45,3774
ZINC HEART LATTICE CHARGER LARGE,266.25,3775
BUTTONS DESIGN JEWELLERY BOX,266.25,3775
PEARLISED IVORY HEART SMALL ,266.21,3777
WHITE SNOW SCANDINAVIAN STOCKING ,266.14,3778
"GARLAND, VINTAGE BELLS",265.88,3779
WAKE UP COCKEREL TILE COASTER,265.59,3780
CUBIC MUG PINK POLKA DOT,265.2,3781
HANGING HEART BASKET,265.14,3782
FOLK ART METAL HEART T-LIGHT HOLDER,264.04,3783
BLUE CAT BISCUIT BARREL PINK HEART,264.0,3784
POLKADOT MUG PINK ,262.86,3785
RED ENAMEL FLOWER RING,262.55000000000007,3786
FAIRY CAKE PLACEMATS ,262.05,3787
PINK CANDYSTUFT ARTIFICIAL FLOWER,261.90999999999997,3788
GYMKHANNA TREASURE BOOK BOX,261.84000000000003,3789
PINK GINGHAM ROSE FLOOR CUSHION,261.35,3790
ROUND WHITE CONFETTI IN TUBE,260.7,3791
AMBER CHUNKY BEAD BRACELET W STRAP,259.54999999999995,3792
GREEN MURANO TWIST BRACELET,259.25,3793
PSYCHEDELIC METAL SIGN CALENDAR,259.15,3794
PINK MURANO TWIST NECKLACE,258.7,3795
TRANSPARENT ACRYLIC TAPE DISPENSER,258.36,3796
DOORKNOB CRACKED GLAZE IVORY,258.3,3797
LARGE GLASS SUNDAE DISH CLEAR,258.2,3798
BEADED CRYSTAL HEART GREEN SMALL,258.08,3799
BLUE NEW BAROQUE FLOCK CANDLESTICK,258.06,3800
DECORATION SITTING BUNNY,257.60999999999996,3801
DECORATION WOBBLY CHICKEN,256.11,3802
FLOWER WINDMILL,255.51000000000002,3803
CANDY POP CHUNKY KNITTED THROW ,254.25,3804
ZINC WIRE SWEETHEART LETTER TRAY,253.24,3805
IVORY SHELL HEART NECKLACE,253.17000000000002,3806
CRYSTAL STILETTO PHONE CHARM,252.45,3807
MINI LADLE LOVE HEART RED ,252.24,3808
SET/6 SILVER REINDEER T-LIGHTS,252.2,3809
AMBER CHUNKY GLASS+BEAD NECKLACE,250.95,3810
KASBAH LANTERN WITH GLASS ,250.8,3811
TIGRIS EYE CHUNKY CHARM BRACELET,250.6,3812
FRENCH PAISLEY CUSHION COVER,250.00000000000003,3813
CROCHET BEAR WITH BLUE STRIPES,249.9,3814
CANDY SPOT BUNNY,249.45000000000002,3815
TEATIME PUSH DOWN RUBBER,249.35,3816
"TUMBLER, ENGLISH ROSE",249.15,3817
CLEAR LOVE BIRD T-LIGHT HOLDER,249.10999999999999,3818
DECORATIVE NET CANOPY LEOPARD,248.75,3819
"ROUND SNACK BOXES ,SET 4, FRUITS ",247.8,3820
WOODLAND LARGE RED FELT HEART,247.5,3821
CORDIAL GLASS JUG,247.5,3821
CLASSIC SUGAR DISPENSER,247.32,3823
WOODLAND SMALL BLUE FELT HEART,246.51000000000002,3824
PINK CHICK EGG WARMER + EGG CUP,246.25,3825
LA PALMIERA METAL SIGN CALENDAR,246.0,3826
GLASS CHALICE BLUE  LARGE ,245.25,3827
SIX STRING SCANDINAVIAN HEART DECS,244.85000000000002,3828
GREEN ENAMEL FLOWER RING,244.85000000000002,3828
PINK OWL DECORATION,244.8,3830
BLUE OWL DECORATION,244.8,3830
BLUE CIRCLES DESIGN TEDDY,244.8,3830
WHITE CHOCOLATE SCENT CANDLE,244.35,3833
50CM METAL STRING WITH  7 CLIPS,244.12,3834
PINK B'FLY C/COVER W BOBBLES,243.95000000000002,3835
IVORY HANGING DECORATION  CHICKEN,243.95,3836
BLUE POLKADOT PASSPORT COVER,243.84,3837
FELT FARM ANIMAL SHEEP,243.14,3838
4 PINK FLOCK CHRISTMAS BALLS,241.75,3839
ANTIQUE IVORY WIRE BOWL SMALL,241.53,3840
"WRAP, CAROUSEL",241.5,3841
WHITE ROUND PORCELAIN TLIGHT HOLDER,241.5,3841
SILVER LARIAT 40CM,241.4,3843
 SILVER T-LIGHT SETTING,240.15,3844
SET OF 3 PANTRY WOODEN SPOONS,240.0,3845
ORIENTAL RED CUSHION COVER ,239.8,3846
SWEET PUDDING STICKER SHEET,239.7,3847
RUSTIC STRAWBERRY JAMPOT LARGE ,238.56,3848
WOVEN FROST CUSHION COVER,238.5,3849
DOORKNOB CRACKED GLAZE BLUE,238.5,3849
ENGLISH ROSE SMALL SCENTED FLOWER,238.0,3851
WHITE 3 FRAME BIRDS AND TREE ,237.79999999999998,3852
LILY BROOCH AMETHYST COLOUR,237.6,3853
MULTICOLOUR FEATHERS CURTAIN,236.40000000000003,3854
ORIGAMI OPIUM INCENSE/CANDLE SET ,236.39999999999998,3855
CHERRY BLOSSOM PASSPORT COVER,236.18,3856
ASSTD COL BUTTERFLY/CRYSTAL W/CHIME,235.19,3857
HEN PARTY CORDON BARRIER TAPE,235.0,3858
PINK PATCH PURSE BLUE HEART,234.29999999999998,3859
RETRO BROWN BALL ASHTRAY ,234.15,3860
EGG CUP HENRIETTA HEN PINK,233.75,3861
PARTY CONES CANDY DECORATION,233.27999999999997,3862
ENGLISH ROSE MUG IN GIFT BOX,232.89,3863
WOODLAND SMALL PINK FELT HEART,232.4,3864
FUNKY GIRLZ ASST MAGNETIC MEMO PAD,232.04999999999998,3865
DARK PINK FLOCK GLASS CANDLEHOLDER,231.98999999999998,3866
PINK BUNNY EASTER EGG BASKET,231.9,3867
"BISCUIT TIN, RED,IVORY, VINTAGE",230.55,3868
PSYCHEDELIC TILE COASTER,230.5,3869
BLUE BUNNY EASTER EGG BASKET,230.25,3870
PINK MINI TAPE MEASURE ,230.1,3871
12 PINK HEN+CHICKS IN BASKET,229.5,3872
LARGE BLUE PROVENCAL CERAMIC BALL,228.84,3873
FINE SILVER NECKLACE W PASTEL FLOWE,228.75,3874
WHITE SQUARE TABLE CLOCK,228.54,3875
BLUE VICTORIAN FABRIC HEART BOX,228.39,3876
GEISHA GIRL CHOPSTICKS SET/5,228.15,3877
T-LIGHT HOLDER SILVER PETIT FOUR ,227.5,3878
BLACK SILOUETTE CANDLE PLATE ,227.4,3879
PSYCHEDELIC TILE HOOK,227.25,3880
VINTAGE NOTEBOOK BEAUTY GIRL,227.15000000000003,3881
HEARTS WRAPPING TAPE ,226.76000000000002,3882
F.FAIRY S/3 CANDLE/GLASS,226.5,3883
WALL ART DOG AND BALL ,226.29000000000002,3884
RAINBOW PEGS PHOTO CLIP STRING,226.23000000000002,3885
FAIRY CAKES RECTANGLUAR BOXES,226.1,3886
This is a test product.,226.0,3887
TRAVEL CARD WALLET VINTAGE ROSE ,225.78,3888
SET/6 GOLD REINDEER T-LIGHT CANDLES,225.54999999999998,3889
GOLD FABRIC MIRROR,225.49,3890
PORCELAIN BUDAH INCENSE HOLDER,225.4,3891
YELLOW KNITTED KIDS RUCKSACK,222.75,3892
ASSORTED CIRCULAR MOBILE,221.88,3893
NEW ENGLAND CERAMIC CAKE SERVER,221.85,3894
FROSTED WHITE BASE ,221.35,3895
BOX/12 MOTHER & CHICK IN BASKET/BOW,220.79999999999998,3896
PINK POODLE HANGING DECORATION ,220.79,3897
RUBY GLASS CLUSTER BRACELET,220.15,3898
DARK CHOCOLATE SCENTCANDLE,219.75,3899
BLACK FLOWER CANDLE PLATE,219.66,3900
DAISY ERASERS IN BAG,219.34,3901
PINK CRYSTAL HEART PHONE CHARM,219.29999999999998,3902
WHITE BAROQUE CARRIAGE CLOCK,218.89999999999998,3903
SILVER/BLACK ORBIT NECKLACE,218.89999999999998,3903
VANILLA SCENT CAKE CANDLE ,218.88,3905
CRYSTAL STUD EARRINGS CLEAR DISPLAY,218.88,3905
BLUE POLKADOT PURSE ,218.82000000000002,3907
75 BLACK PETIT FOUR CASES,218.82,3908
VINTAGE CAT FOOD CONTAINER,218.14,3909
RIVIERA NECKLACE,217.8,3910
ORIGAMI JASMINE INCENSE IN TUBE,217.6,3911
ORIGAMI LAVENDER INCENSE+FLOWER,217.1,3912
CARDHOLDER GINGHAM HEART,216.9,3913
VINTAGE BEAD PINK JEWEL BOX,216.75,3914
PURPLE GEMSTONE NECKLACE 45CM,216.75,3914
BLACK DIAMANTE EXPANDABLE RING,216.75,3914
CHILDRENS APRON DOLLY GIRL ,216.3,3917
SET 8 CANDLES VINTAGE DOILEY,216.29999999999998,3918
RED POPPY ARTIFICIAL FLOWER,215.93,3919
PINK MILKSHAKE GLASS,215.5,3920
PINK KNITTED COW STUFFED TOY,215.34,3921
TRIPLE WIRE HOOK PINK HEART,215.0,3922
MINI HAND WARMER BABUSHKA DESIGN,214.8,3923
4 SKY BLUE DINNER CANDLES,214.71,3924
BLUE GINGHAM ROSE FLOOR CUSHION ,214.65,3925
SNACK TRAY HAPPY FOREST  ,214.5,3926
PINK RETRO BIG FLOWER BAG,214.5,3926
PIN CUSHION RUSSIAN DOLL BLUE,214.4,3928
SUMMER DAISIES BAG CHARM,214.2,3929
SET/3 RABBITS FLOWER SKIPPPING ROPE,214.2,3929
36 PENCILS TUBE POSY,213.75,3931
BIG PINK POODLE,213.7,3932
PINK FLOCK PHOTO FRAME ,213.6,3933
"FEATHER DUSTER, COAL BLACK",212.5,3934
PACK/12 BLUE REINDEER CARD,212.40000000000003,3935
FREESTYLE CANVAS ART PICTURE,212.25,3936
ASSORTED TUTTI FRUTTI KEYRING,211.64999999999998,3937
CANDY SPOT EGG WARMER RABBIT,211.43,3938
CLEAR ACRYLIC FACETED BANGLE,211.25000000000003,3939
GOLD TEDDY BEAR,211.25,3940
BLUE SPOTTY BEAKER ,210.6,3941
SMALL POP BOX FUNKY MONKEY,210.48000000000002,3942
SPACE CADET WHITE,210.48,3943
BEADED CRYSTAL HEART GREEN ON STICK,210.18,3944
VINTAGE BLUE TINSEL REEL,209.58,3945
VINTAGE KEEPSAKE BOX PINK FLOWER,209.54999999999998,3946
GOLD APERITIF GLASS,209.36,3947
"ACRYLIC JEWEL ICICLE, PINK",208.62,3948
PINK HEART OF GLASS BRACELET,208.25,3949
ENGLISH ROSE SCENTED HANGING HEART,208.25,3949
DECORATIVE VINTAGE COFFEE  BOX,208.2,3951
DEEP BLUE GLASS GEMS IN BAG,208.12,3952
ENGLISH ROSE TEA SET IN GIFT BOX,207.69,3953
 VINTAGE DESIGN GIFT TAGS,207.39999999999998,3954
BEADED CRYSTAL HEART BLUE ON STICK,207.34,3955
FLOWER PENCIL/RUBBER+5 MINI PENCILS,207.06,3956
S/2 BEACH HUT STOOLS,206.70000000000002,3957
"CARD, GINGHAM ROSE ",206.64000000000001,3958
YELLOW RED FLOWER PIGGY BANK,206.54999999999998,3959
"FOLK ART GREETING CARD,pack/12",206.50000000000003,3960
SILVER FINCH DECORATION,206.39000000000001,3961
FUSCHIA FLOWER PURSE WITH BEADS,206.26,3962
SMALL MARAKESH LANTERN ON STICK,206.25,3963
GREEN WIRE STANDING CANDLE HOLDER,206.25,3963
BLUE POLKADOT LUGGAGE TAG ,206.01,3965
SET/6 POSIES PAPER PLATES,205.7,3966
CREAM CLIMBING HYDRANGA ART FLOWER,205.35,3967
PURPLE ACRYLIC FACETED BANGLE,204.65,3968
CRYSTAL DIAMANTE EXPANDABLE RING,204.0,3969
FLOWERS TILE HOOK,203.34,3970
MIRRORED WALL ART GENTS,202.85999999999999,3971
GREEN GEISHA GIRL ,202.5,3972
BLUE GEISHA GIRL ,202.5,3972
 FAIRY CAKE CANDLES,202.05,3974
"ACRYLIC JEWEL SNOWFLAKE,PINK",202.02,3975
SET/6 BLACK SNOWFLAKE T-LIGHTS ,201.91,3976
CHERRY BLOSSOM CANVAS ART PICTURE,201.3,3977
BEIGE PHOTO ALBUM,201.29999999999998,3978
FLOWER FAIRY POTPOURRI CUSHION LILY,201.24,3979
"HANGING FLOWERS+MIRROR,BLUE",200.26000000000002,3980
PASTEL PINK PHOTO ALBUM,199.79999999999998,3981
RED PEONY TABLE CLOCK,199.35,3982
WHITE MOROCCAN METAL LANTERN,199.17,3983
PINK OVAL SHAPE TRINKET BOX,199.0,3984
BLUE MURANO TWIST NECKLACE,199.0,3984
4 GOLD FLOCK CHRISTMAS BALLS,198.0,3986
SET OF 6 DOTS CHOPSTICKS,197.05,3987
"BREAD BIN, DINER STYLE, MINT",196.35,3988
MIRRORED WALL ART SPLODGES,195.0,3989
"ROUND SNACK BOXES ,SET4, WOODLAND ",194.70000000000002,3990
LA PALMIERA TILE HOOK,194.61,3991
ORIGAMI ROSE INCENSE CONES,194.28,3992
WOVEN CANDY CUSHION COVER ,193.95000000000002,3993
MIRRORED WALL ART TABLE LAMP,193.23000000000002,3994
ENGLISH ROSE TORCH,193.1,3995
ANT COPPER RED BOUDICCA BRACELET,193.05,3996
KINGS CHOICE SMALL TUBE MATCHES,193.04999999999998,3997
PAIR OF ENAMEL FLOWER CLUSTER SLIDE,192.9,3998
EASTER BUNNY HANGING GARLAND,192.5,3999
CRYSTAL SEA HORSE PHONE CHARM,191.76,4000
TURQUOISE GLASS TASSLE BAG CHARM ,191.75000000000003,4001
ASS FLORAL PRINT SPIRIT LEVEL ,191.53,4002
RED KUKUI COCONUT SEED NECKLACE,191.3,4003
BLACK GEMSTONE NECKLACE 45CM,191.25,4004
SET/12 ZINC CHRISTMAS DECORATIONS,191.10000000000002,4005
"CAKE TIN, ROUND, VINTAGE MINT,IVORY",190.65,4006
SILVER BLUE EGG T-LIGHT HOLDER,189.89,4007
DONKEY TAIL GAME ,189.54000000000002,4008
RED PUDDING SPOON,189.54,4009
LILAC FLOWER BLOCK TABLE LAMP,188.79999999999998,4010
TURQUOISE CRYSTAL+GLASS BRACELET,188.10000000000002,4011
GREEN EASTER EGG HUNT START POST,187.2,4012
GOLD/M.O.P PENDANT ORBIT NECKLACE,187.0,4013
AMETHYST DIAMANTE EXPANDABLE RING,187.0,4013
BUTTERFLY WATER TRANSFER TATTOOS ,186.95,4015
ANT WHITE IRON BASKET,186.35,4016
GIFT BAG LARGE VINTAGE CHRISTMAS,185.0,4017
PINK ALLIUM  ARTIFICIAL FLOWER,184.21,4018
S/6 SEW ON CROCHET FLOWERS,183.75,4019
SET OF 4 DOTTY PLACEMATS ,183.3,4020
"PEARL & SHELL 42""NECKL. GREEN",182.75,4021
LAVENDER INCENSE 40 CONES IN TIN,182.65,4022
POPART COL BALLPOINT PEN ASST,182.58,4023
"ACRYLIC HANGING JEWEL,BLUE",182.19,4024
BLUE PILLAR CANDLE SILVER FLOCK,182.15,4025
PLANTPOT SINGLE HOOK PISTACHIO,182.09,4026
BLUE CHERRY BLOSSOM CUP & SAUCER,181.5,4027
MINI JIGSAW BUNNIES AT HOME,181.44,4028
SET/3 COLOUR PAINTED KASHMIRI STOOL,179.85000000000002,4029
SET OF 4 CAROUSEL PLACEMATS ,179.81,4030
GREY ACRYLIC FACETED BANGLE,179.70000000000002,4031
A PRETTY THANK YOU CARD,179.64000000000001,4032
S/60 PINK FLUFFY CHICKS IN BOX,179.1,4033
POP ART PUSH DOWN RUBBER ,179.04,4034
NEW BAROQUE SMALL NECKLACE BLACK,178.5,4035
PINK CRYSTAL+GLASS BRACELET,178.20000000000002,4036
DOLLCRAFT GIRL AMELIE,178.20000000000002,4036
SET OF 72 BLACK PAPER DOILIES ,176.89999999999998,4038
S/6 MULTICOLOUR ORNAMENETAL CANDLE,176.75,4039
"CAKE TIN, 3 TIER MINT/IVORY",176.75,4039
LUNCHBAG PINK RETROSPOT,176.55,4041
PINK KASHMIRI BOXED MIRROR,176.0,4042
BIRD BOX CHRISTMAS TREE DECORATION,175.95,4043
DOTTY PLACEMATS ,175.8,4044
MIRRORED WALL ART FOXY,175.35,4045
"FLOWER GLASS GARLAND NECKL.36""BLUE",174.9,4046
S/3 PUPPIES CHRISTMAS DECORATIONS,174.05,4047
BLUE ROUND COMPACT MIRROR,173.75,4048
DRAGONS BLOOD INCENSE,173.54,4049
BLUE DAISY MOBILE,172.51,4050
RED   ACRYLIC FACETED BANGLE,171.95000000000002,4051
MIRRORED WALL ART LADIES,171.75,4052
PARTY PIZZA DISH BLUE RETROSPOT,171.7,4053
PINK FLOCK TABLE CLOCK ,170.79999999999998,4054
FAIRY CAKES TABLE CLOCK,170.04999999999998,4055
BLUE FLOWER T-LIGHT HOLDER,169.72,4056
GOLD M PEARL  ORBIT NECKLACE,169.14999999999998,4057
"ACRYLIC JEWEL ICICLE, BLUE",168.38,4058
JADE CRYSTAL+GLASS BRACELET,168.3,4059
IVORY FELT EASTER RABBIT GARLAND,168.29999999999998,4060
PURPLE CHUNKY GLASS+BEAD NECKLACE,167.29999999999998,4061
FLOWER GARLAND NECKLACE RED,166.95000000000002,4062
72 ROUND PINK DOILIES,166.75,4063
NEW ENGLAND MILK JUG W GIFT BOX,166.6,4064
METALIC LEAVES BAG CHARMS,166.17,4065
RED SPOTTY BEAKER ,165.75,4066
"CANDLE IN JAR COLLAGE , VANILLA",165.75,4066
DAIRY MAID CERAMIC TOASTRACK,165.20000000000002,4068
GIANT BLACK SUNGLASSES,163.79999999999998,4069
PINK SMALL JEWELLED PHOTOFRAME,163.35,4070
COTE D'AZURE NECKLACE,163.35,4070
ENAMEL BLUE RIM TEA CONTAINER,162.48,4072
PINK STRAWBERRY HANDBAG ,162.25000000000003,4073
PINK KNITTED KIDS RUCKSACK,162.0,4074
S/4 ROSE PINK DINNER CANDLES,161.85,4075
MURANO STYLE GLASS BRACELET BLACK,161.0,4076
NUMBER TILE VINTAGE FONT No ,160.38,4077
SET 4 PICNIC CUTLERY BLUEBERRY,159.9,4078
CERAMIC HEART CAKE MONEY BANK,159.6,4079
COW  SOCK PUPPET,159.3,4080
ANT SILVER LIME GREEN BOUDICCA RING,159.3,4080
CANDY PINK FRENCH BOUDOIR CLOCK,159.2,4082
PINK BERTIE GLASS BEAD BAG CHARM,159.0,4083
MUG AND COASTER SET RED CIRCLES,158.76,4084
SILVER M.O.P ORBIT BRACELET,158.4,4085
WHITE HONEYCOMB PAPER FAN ,158.36,4086
FOOD/DRINK SPUNGE STICKERS,158.19,4087
ENAMEL CAT BOWL CREAM,157.8,4088
WRAP RED DOILEY,157.5,4089
WRAP CAROUSEL,157.5,4089
RESIN NECKLACE W PASTEL BEADS,157.5,4089
ARMY CAMO WRAPPING TAPE,157.17999999999998,4092
POPART RECT PENCIL SHARPENER ASST,156.9,4093
ZINC WIRE KITCHEN ORGANISER,156.8,4094
TUMBLER BAROQUE,156.78,4095
TUSCAN VILLA BIRD TABLE ,156.75,4096
FLAT PALM T-LIGHT HOLDER,156.65,4097
FAIRY CAKES TILE COASTER,156.25,4098
BLUE KNITTED EGG COSY,155.60999999999999,4099
CREAM HANGING HEART T-LIGHT HOLDER,155.35,4100
CHAMBRE HOOK,155.07,4101
SPACE CADET BLACK,154.91,4102
"FELTCRAFT HAIRBAND, S/2, RED/BLUE",154.68,4103
SWEET VALENCIA CANDLE+CUP,154.63,4104
MIDNIGHT BLUE VINTAGE EARRINGS,153.75,4105
BLOKEY SILVER TOOL SET,153.45000000000002,4106
BEST DAD CANDLE LETTERS,153.35999999999999,4107
LEOPARD PRINT HOT WATER BOTTLE,153.3,4108
WHITE VINT ART DECO CRYSTAL NECKLAC,153.0,4109
AMBER DIAMANTE EXPANDABLE RING,153.0,4109
POCKET MIRROR WOODLAND,152.5,4111
HANGING METAL CHICKEN DECORATION,152.5,4111
HEART TRELLISTRIPLE T-LIGHT HOLDER,152.24,4113
DOOR MAT CAMOUFLAGE,152.0,4114
S/4 SKY BLUE DINNER CANDLES,151.85,4115
PINK KNITTED EGG COSY,151.70999999999998,4116
MAGIC DRAWING SLATE FIDO,151.2,4117
BLACK PHOTO ALBUM ,150.6,4118
ST GEORGE SET OF 10 PARTY LIGHTS,150.45000000000002,4119
NECKLACE+BRACELET PINK BUTTERFLY,150.45,4120
FLOWER FAIRY 5 DRAWER LINERS,150.45,4120
CLEAR CRYSTAL STAR PHONE CHARM,150.44,4122
BLUE EASTER EGG HUNT START POST,150.15,4123
ORIGAMI VANILLA INCENSE+FLOWER ,150.0,4124
HEART SHAPE BUTTON FRAME ,150.0,4124
CAPIZ CHANDELIER,149.75,4126
METAL RABBIT LADDER EASTER ,149.6,4127
KIDS CUTLERY SPACEBOY ,149.4,4128
KIDS CUTLERY DOLLY GIRL ,149.4,4128
RETRO LEAVES MAGNETIC NOTEPAD,149.35,4130
FLOWER FAIRY SUMMER BOUQUET SACHET,149.1,4131
SILVER/M.O.P PENDANT ORBIT NECKLACE,148.75,4132
RASPBERRY ANT COPPER FLOWER NECKLAC,148.75,4132
COPPER/OLIVE GREEN FLOWER NECKLACE,148.75,4132
 WHITE BAMBOO RIBS LAMPSHADE,148.26,4135
GREEN GLASS TASSLE BAG CHARM,147.5,4136
DOT MATRIX CANVAS ART PICTURE,147.05,4137
SET OF 4 POLKADOT COASTERS,146.17,4138
SMALL BLUE PROVENCAL CERAMIC BALL,145.2,4139
PINK TEATIME PRINT BOWL,145.0,4140
PINK TV TRAY TABLE ,144.5,4141
ICON PLACEMAT POP ART ELVIS,144.3,4142
BLACK CHRISTMAS FLOCK DROPLET ,144.07,4143
THREE CANVAS LUGGAGE TAGS,143.85999999999999,4144
GREEN WITH METAL BAG CHARM,143.55,4145
CAROUSEL DES CHILD'S APRON,143.54999999999998,4146
SPACE BOY CHILDRENS CUP,143.3,4147
SILVER SLEIGHBELL  WREATH,143.1,4148
"FLOWER GLASS GARLD NECKL36""AMETHYST",143.1,4148
6 SEGMENT COLOURED SNACK BOWL ,143.1,4148
TEXRIO TOMATOES CANDLE+CUP,142.94,4151
TURQUOISE HEART OF GLASS BRACELET,142.8,4152
GREEN HEART OF GLASS BRACELET,142.8,4152
REDWHITE STRIPE SCANDINAVIAN HEART ,142.5,4154
PINK ROUND COMPACT MIRROR,142.5,4154
DOORSTOP RUSSIAN DOLL GINGHAM,142.5,4154
POP'S GREASY SPOON METAL SIGN,141.9,4157
PAISLEY PARK CARD,141.84,4158
WHITE WITH BLACK CATS BOWL,141.68,4159
AMETHYST HOOP EARRING FLORAL LEAF,141.60000000000002,4160
SILVER M.O.P ORBIT DROP EARRINGS,140.25,4161
ROSE DU SUD CUSHION COVER,139.7,4162
METAL HERB GERDEN CONTAINER,139.68,4163
PINK FLOCK GLASS CANDLEHOLDER,139.54,4164
PURPLE AMETHYST NECKLACE W TASSEL,139.29999999999998,4165
GREEN MURANO TWIST NECKLACE,139.29999999999998,4165
GREEN FLORAL FELTCRAFT SHOULDER BAG,138.75,4167
PACK OF 12 CHRISTMAS FUN CARDS,138.65,4168
HEART MEASURING SPOONS LARGE,138.6,4169
SET 4 PICNIC CUTLERY CHERRY ,138.45,4170
CRYSTAL FROG PHONE CHARM,138.32999999999998,4171
BATHROOM HOOK,137.76,4172
F FAIRY POTPOURRI CUSHIONS LAVENDER,137.54,4173
WHITE HEART OF GLASS BRACELET,136.85,4174
EAU DE NILE JEWELLED T-LIGHT HOLDER,136.85,4174
NUMBER TILE COTTAGE GARDEN 1,136.5,4176
"HANGING FLOWERS+MIRROR,PINK",136.44,4177
DOGGY RUBBER,136.07999999999998,4178
"LETTER ""A"" BLING KEY RING",135.71,4179
"FLOWER GLASS GARLAND NECKL.36""GREEN",135.15,4180
FLOWER BURST SILVER RING OPAL,135.0,4181
PORCELAIN CHERUB BELL SMALL,134.82,4182
NUMBER TILE COTTAGE GARDEN 2,134.54999999999998,4183
RED RETROSPOT WASHBAG,134.4,4184
LILY BROOCH OLIVE COLOUR,133.65,4185
EASTER BUNNY WITH BASKET ON BACK,132.6,4186
SET OF 4 POLKADOTS COASTERS,132.45,4187
TUSCAN VILLA BIRD FEEDER,132.0,4188
SMALL JEWELLERY STAND,132.0,4188
GREEN METAL BOX TOP SECRET,132.0,4188
FOLDING SHOE TIDY,132.0,4188
PARTY PIZZA DISH PINK RETROSPOT,131.75,4192
PIG MUG IN TWO COLOUR DESIGNS,131.44,4193
DOLPHIN WINDMILL,131.44,4193
GREEN VINTAGE EARRINGS ,131.25,4195
FLAMES SUNGLASSES PINK LENSES,131.25,4195
DOOR MAT SWEET HOME,131.25,4195
CRYSTAL PAIR HEART HAIR SLIDES,131.25,4195
"BATHROOM SCALES, TROPICAL BEACH",131.25,4195
YELLOW VW BEETLE CERAMIC MONEY BOX,130.9,4200
FLOWERS WALL THERMOMETER,130.05,4201
VINTAGE NOTEBOOK RED ROSE,129.8,4202
ORIGAMI ROSE INCENSE+FLOWER,129.3,4203
"GARLAND , WOODEN  "" HAPPY EASTER""",128.75,4204
GOLDIE LOOKING MIRROR,128.70000000000002,4205
BLUE TRAVEL FIRST AID KIT,128.7,4206
BIG POLKADOT MUG,128.33999999999997,4207
FUNKY GIRL ADDRESS BOOK,128.21,4208
PINK GLASS CHUNKY CHARM BRACELET,127.8,4209
LARGE ZINC GLASS CANDLEHOLDER,127.68,4210
"BREAD BIN, DINER STYLE, PINK",127.6,4211
PURPLE VINTAGE EARRINGS,127.5,4212
BLACK VINT ART DEC CRYSTAL NECKLACE,127.5,4212
BLACK 3 TIER GLASS PLATE STAND,127.5,4212
S/6 PAPER BOXES CURIOUS IMAGES ,127.2,4215
PINK BITTY LIGHT CHAIN,126.85,4216
GREEN CHENILLE SHAGGY RUG,126.85,4216
SET 4 PICNIC CUTLERY FONDANT,126.75,4218
GLASS SONGBIRD STORAGE JAR,126.7,4219
SCOTTIES DESIGN BABY BIB,126.25,4220
GLASS BONBON JAR. D'AMANDES,126.25,4220
ORANGE COCKTAIL GLASS LAMP,126.0,4222
NUMBER TILE VINTAGE FONT 3,125.89,4223
LARGE JEWELLERY STAND,125.0,4224
SILVER OVAL JEWELLED MIRROR,124.95,4225
PINK GINGHAM ROSE CUSHION COVER,124.95,4225
"ACRYLIC JEWEL ANGEL,PINK",124.88,4227
GROOVY CACTUS INFLATABLE,124.61,4228
PINK SQUARE TABLE CLOCK,124.55000000000001,4229
A4 WALL TIDY BLUE OFFICE,124.44000000000001,4230
PURPLE BERTIE GLASS BEAD BAG CHARM,124.2,4231
WAKE UP COCKEREL TILE HOOK,124.17,4232
ANT SILVER FUSCHIA BOUDICCA RING,123.90000000000002,4233
PINK HORSE SOCK PUPPET KIT,123.9,4234
"GLASS JAR, KINGS CHOICE SOAP",123.9,4234
JACOBS LADDER SMALL,123.84,4236
ROSE FLOWER CANDLE+INCENSE 16X16CM,123.75,4237
GOLD FLOWER CUSHION COVER ,123.6,4238
BREAD BIN DINER STYLE BLACK,123.6,4238
HEN HOUSE W CHICK STANDING,123.36,4240
3D SHEET OF SEA WORLD STICKERS,123.25,4241
SET/6 POSIES PAPER CUPS,123.22,4242
SET OF 3 MINI HANGING PORTRAITS,123.2,4243
"NUMBER TILE COTTAGE GARDEN, 1",122.85,4244
LARGE PARLOUR FRAME,122.85,4244
LA STREGA CANVAS PICTURE ,122.55000000000001,4246
MOSAIC CANDLE DISH BLUE PURPLE,122.4,4247
FUNKY MONKEY GIFT BAG SMALL,121.86,4248
MOSAIC GLASS BALL CANDLEHOLDER,121.25,4249
MAGIC SLATE SPACEBOY ,120.96000000000001,4250
MAGIC SLATE FIDO,120.96000000000001,4250
MAGIC SLATE BUNNIES AT HOME ,120.96000000000001,4250
WHITE METAL BAROQUE PHOTO FRAME,120.0,4253
NEW ENGLAND PLACEMATS,120.0,4253
GIFT BAG LARGE SPOT ,120.0,4253
PINK/FLOWER RABBIT EGG WARMER ,119.7,4256
VINTAGE ZINC WATERING CAN,119.39999999999999,4257
WHITE ROSE C/COVER,119.0,4258
SILVER/NATURAL SHELL NECKLACE,119.0,4258
SET OF 12 T-LIGHTS VINTAGE DOILEY,118.94999999999999,4260
FOLDING MIRROR HOT PINK ,118.92000000000002,4261
CHILDRENS SPACEBOY MUG,118.80000000000001,4262
"POCKET MIRROR ""GLAMOROUS""",118.75,4263
TEATIME FUNKY FLOWER BACKPACK FOR 2,118.64999999999999,4264
PINK STOCKING CHRISTMAS DECORATION,118.56,4265
PINK FEATHERS CURTAIN,117.78,4266
"LETTER ""C"" BLING KEY RING",117.53999999999999,4267
"HANGING FLOWERS+MIRROR,CLEAR",117.05,4268
NUMBER TILE COTTAGE GARDEN 9,117.0,4269
CAROUSEL PONIES BABY BIB,116.87,4270
NATURAL RIVIERA HANDBAG,116.7,4271
PRICE'S CANDLE PEACH,116.5,4272
RED PURSE WITH PINK HEART,116.4,4273
SILVER DROP EARRINGS WITH FLOWER,116.25,4274
BLACK MEDIUM GLASS CAKE STAND,115.86,4275
BROWN KUKUI COCONUT SEED NECKLACE,115.65,4276
NUMBER TILE COTTAGE GARDEN No,115.5,4277
LUNCH BAG VINTAGE DOILEY ,115.5,4277
ZINC HEART LATTICE CHARGER SMALL,115.05000000000001,4279
NUMBER TILE COTTAGE GARDEN 4,115.05,4280
FRENCH STYLE STORAGE JAR JAM,114.85,4281
WHITE VINTAGE CRYSTAL BRACELET,114.75,4282
"LETTER ""S"" BLING KEY RING",114.75,4282
NUMBER TILE VINTAGE FONT 6 ,114.19,4284
WALL ART BICYCLE SAFTEY ,114.14999999999999,4285
WOVEN SUNSET CUSHION COVER ,113.85000000000001,4286
"NUMBER TILE COTTAGE GARDEN, 9",113.1,4287
NUMBER TILE COTTAGE GARDEN 6,113.1,4287
PINK FLOWER HANGING HEART ,113.05,4289
GLASS BONBON JAR. SUPERFINES,112.5,4290
3 PINK HEN+CHICKS IN BASKET,112.35,4291
PINK/PURPLE CIRCLE CURTAIN,112.32000000000001,4292
"LETTER ""K"" BLING KEY RING",112.25,4293
VINTAGE NOTEBOOK PINK FLOWER,112.10000000000001,4294
SQUARE METAL CANDLEHOLDER BASE,112.05,4295
ORIGAMI VANILLA INCENSE CONES,111.81,4296
VINTAGE GOLD TINSEL REEL,111.3,4297
SET/2 BLUE  NOODLE BASKETS,111.14999999999999,4298
"NUMBER TILE COTTAGE GARDEN, 5",111.14999999999999,4298
BLUE/PINK NEST STRIPE BOX,111.12,4300
DAISY HAIR BAND,110.55,4301
ROSE DU SUD CHILDRENS APRON,110.5,4302
NEW BAROQUE B'FLY NECKLACE PINK,110.5,4302
FLORAL DINOSAUR GREEN,110.5,4302
