Description,revenue,product_rank
CUPID DESIGN SCENTED CANDLES,1015.1,2453
MIRROR MOSAIC VOTIVE HOLDER,1014.72,2454
MINI PLAYING CARDS DOLLY GIRL ,1013.04,2455
HANGING CLEAR MINI BOTTLE,1012.02,2456
BOOM BOX SPEAKER GIRLS,1011.6,2457
CUBIC MUG FLOCK BLUE ON BROWN,1011.48,2458
MODERN VINTAGE COTTON SHOPPING BAG,1011.45,2459
EAU DE NILE JEWELLED PHOTOFRAME,1010.7,2460
SMALL CHUNKY GLASS ROMAN  BOWL,1008.19,2461
EIGHT PIECE CREEPY CRAWLIE SET,1007.94,2462
ETCHED GLASS BIRD TREE DECORATION,1007.5,2463
SWEETHEART WALL TIDY ,1007.0799999999999,2464
PINK WHITE SPOTS GARDEN PARASOL,1007.0,2465
ASSORTED EASTER GIFT TAGS,1004.66,2466
MILK PAN PINK POLKADOT,1003.38,2467
POLKADOT RAIN HAT ,1003.33,2468
HANGING QUILTED PATCHWORK APPLES,1003.1700000000001,2469
CHRISTMAS TREE HEART DECORATION,1002.9599999999999,2470
FRENCH BLUE METAL DOOR SIGN 3,1001.18,2471
PACK 6 HEART/ICE-CREAM PATCHES,1001.17,2472
FELT FARM ANIMAL RABBIT,1000.77,2473
WHITE BITTY LIGHT CHAIN ,1000.0799999999999,2474
I LOVE LONDON BEAKER,999.75,2475
IVORY LOVE BIRD CANDLE,999.07,2476
ZINC  HEART T-LIGHT HOLDER,997.18,2477
MISELTOE HEART WREATH CREAM,996.0,2478
PACK OF 12 VINTAGE CHRISTMAS TISSUE,995.4599999999999,2479
SILVER HEARTS TABLE DECORATION,995.33,2480
WRAP CHRISTMAS SCREEN PRINT,994.75,2481
RED FLOCK LOVE HEART PHOTO FRAME,994.0999999999999,2482
ANTIQUE GLASS PLACE SETTING,994.03,2483
RED SHARK HELICOPTER,993.75,2484
36 DOILIES SPACEBOY DESIGN ,993.4499999999999,2485
SET 12 COLOUR PENCILS LOVE LONDON,991.45,2486
HEART MINI PORTRAIT FRAME,990.9,2487
MINI PAINTED GARDEN DECORATION ,990.6199999999999,2488
BLUE PAINTED KASHMIRI TABLE ,990.0,2489
BLUE POLKADOT COFFEE MUG,989.9399999999999,2490
DAIRY MAID TOASTRACK,989.72,2491
CLASSICAL ROSE SMALL VASE,989.55,2492
BLUE POLKADOT WASHING UP GLOVES,989.1,2493
3D SHEET OF DOG STICKERS,987.63,2494
NAMASTE SWAGAT INCENSE,982.44,2495
ASSORTED EASTER DECORATIONS  BELLS,980.5600000000001,2496
GREEN JUICY FRUIT PHOTO FRAME,979.95,2497
PINK POLKADOT KIDS BAG,975.9,2498
DOLLY HONEYCOMB GARLAND,975.9,2498
WHITE WITH BLACK CATS MUG,975.41,2500
3 WICK CHRISTMAS BRIAR CANDLE ,975.0,2501
FELT EGG COSY BLUE RABBIT ,973.0699999999999,2502
GLASS CAKE STAND MIRRORED BASE,972.5999999999999,2503
MRS ROBOT SOFT TOY,972.5500000000001,2504
BLUE ROSE FABRIC MIRROR,972.29,2505
RED RETRO BAR STOOL,970.7,2506
FRENCH BLUE METAL DOOR SIGN 5,969.97,2507
3D SHEET OF CAT STICKERS,969.0,2508
FRENCH STYLE EMBOSSED HEART CABINET,968.8,2509
METAL WALL SHELF UNIT WITH HOOKS,968.08,2510
BIRD DECORATION RED SPOT,966.5899999999999,2511
ASSORTED COLOUR SET 6 TEASPOONS,964.75,2512
LARGE WHITE/PINK ROSE ART FLOWER,964.4300000000001,2513
SET OF 3 CONEY ISLAND OVAL BOXES,961.8,2514
BEACH HUT SHELF W 3 DRAWERS,961.4,2515
FOLDING BUTTERFLY MIRROR RED  ,961.2800000000001,2516
LARGE ROUND CUTGLASS CANDLESTICK,960.6,2517
PACK OF 6 COCKTAIL PARASOL STRAWS,958.32,2518
EASTER DECORATION HANGING BUNNY,958.3,2519
ROSES IN WHITE HEART CANDLE ,958.2099999999999,2520
EASTER TIN CHICKS PINK DAISY,957.0,2521
BLACK SMALL GLASS CAKE STAND,956.64,2522
SILVER RECORD COVER FRAME,955.86,2523
SET OF 12 MINI BUNNIES IN A BUCKET,955.26,2524
EMBROIDERED RIBBON REEL RACHEL ,954.93,2525
PINK DOG BOWL,954.7800000000001,2526
SET OF SKULL WALL STICKERS,950.5000000000001,2527
CHERRY BLOSSOM BATHROOM CABINET,950.4,2528
S/3 FLWR FAIRY LAVENDER CANDLES,949.95,2529
CARD DOG AND BALL ,949.32,2530
ZINC HEART FLOWER T-LIGHT HOLDER,947.18,2531
WRAP GINGHAM ROSE ,943.92,2532
DRAWER KNOB CERAMIC RED,943.75,2533
MUSICAL ZINC HEART DECORATION ,943.64,2534
POCKET BAG PINK PAISELY BROWN SPOT,943.03,2535
MAGAZINE RACK GEBRA ASSORTED ,942.5,2536
ENGLISH ROSE SPIRIT LEVEL ,940.83,2537
BLOSSOM  IMAGES NOTEBOOK SET,940.0,2538
MIRROR MOSAIC GOBLET CANDLE HOLDER,937.25,2539
BLUE YELLOW FLOWER PIGGY BANK,937.1999999999999,2540
VINTAGE BEAD PINK PURSE ,937.0100000000001,2541
WALL ART GARDEN HAVEN ,936.34,2542
FOLKART ZINC STAR CHRISTMAS DEC,935.0,2543
BLACK BIRD GARDEN DESIGN MUG,934.87,2544
HOME SWEET HOME 3 PEG HANGER ,934.1700000000001,2545
MADRAS NOTEBOOK MEDIUM,934.05,2546
TRAVEL CARD WALLET SUKI,932.88,2547
WALL ART BUFFALO BILL ,932.6700000000001,2548
DECORATIVE WICKER HEART SMALL,932.28,2549
PINK POT PLANT CANDLE,932.0500000000001,2550
SILVER  CANDLEPOT JARDIN ,929.2,2551
SKULLS STORAGE BOX LARGE,928.1400000000001,2552
HAWAIIAN GRASS SKIRT ,926.71,2553
METAL SIGN HIS DINNER IS SERVED,924.69,2554
HEART T-LIGHT HOLDER ,924.15,2555
ANIMALS AND NATURE WALL ART,923.97,2556
ZINC SWEETHEART WIRE LETTER RACK,923.63,2557
FOLDING UMBRELLA  WHITE/RED  SPOT,922.05,2558
EMBROIDERED RIBBON REEL ROSIE,921.46,2559
ABSTRACT CIRCLES POCKET BOOK,920.9,2560
DANISH ROSE DECORATIVE PLATE,920.64,2561
EGG CUP MILKMAID HEIDI,919.52,2562
PARTY INVITES FOOTBALL,919.27,2563
SET 5 MINI GATEAUX  FRIDGE MAGNETS,918.68,2564
FOLDING UMBRELLA BLACKBLUE POLKADOT,918.02,2565
 PEACE WOODEN BLOCK LETTERS,917.15,2566
MAGIC DRAWING SLATE GO TO THE FAIR ,916.38,2567
ASSTD FRUIT+FLOWERS FRIDGE MAGNETS,915.12,2568
CRAZY DAISY HEART DECORATION,914.12,2569
PINK POLKADOT GARDEN PARASOL,913.95,2570
GOLD STANDING GNOME,910.25,2571
FLOOR LAMP SHADE WOOD BASE,909.63,2572
EMBROIDERED RIBBON REEL SALLY ,909.14,2573
HANGING BUTTERFLY  EGG,908.89,2574
FLOOR CUSHION ELEPHANT CARNIVAL,908.8,2575
BLUE POLKADOT KIDS BAG,906.81,2576
ROSES ON BLUE TEACUP CANDLE ,905.84,2577
CUSHION COVER PINK UNION JACK,903.89,2578
BIRD DECORATION RED RETROSPOT,903.53,2579
WRAP MONSTER FUN ,903.0,2580
MINI PLAYING CARDS GYMKHANA,901.74,2581
YULETIDE IMAGES S/6 PAPER BOXES,901.5,2582
POLYESTER FILLER PAD 65CMx65CM,901.0,2583
ANTIQUE CREAM CUTLERY SHELF ,901.0,2583
12 ASS ZINC CHRISTMAS DECORATIONS,900.9000000000001,2585
S/3 PINK COL METAL BASKET W HANDLE,900.3000000000001,2586
BLUE TEATIME PRINT BOWL ,900.07,2587
PINK NEW BAROQUECANDLESTICK CANDLE,898.7,2588
SILVER VANILLA FLOWER CANDLE POT,898.56,2589
WALL ART DOLLY GIRL ,896.3700000000001,2590
LARGE HANGING GLASS+ZINC LANTERN,896.0,2591
HOME SWEET HOME BOTTLE ,895.0400000000001,2592
FLOWER FAIRY INCENSE LAVENDER,892.91,2593
ADULT APRON APPLE DELIGHT,891.9300000000001,2594
GARDEN PATH NOTEBOOK ,891.75,2595
TABLE LAMP WHITE SHADE WOOD BASE,891.55,2596
SET/4 COLOURFUL MIXING BOWLS,891.5,2597
BLUE PAISLEY NOTEBOOK,889.95,2598
SWEETIES  STICKERS,889.9499999999999,2599
SILVER GLASS T-LIGHT SET,888.9300000000001,2600
DOORSTOP RACING CAR DESIGN,888.23,2601
SMALL RED SPOT  WINDMILL,886.46,2602
PINK PAISLEY SQUARE TISSUE BOX ,886.28,2603
SPACEBOY WALL ART,885.9000000000001,2604
SET OF 4 NAPKIN CHARMS LEAVES   ,882.99,2605
TRAVEL CARD WALLET RETROSPOT,882.24,2606
CHRISTMAS MUSICAL ZINC TREE,881.72,2607
SMALL SPOTTY CHOCOLATE GIFT BAG ,881.5699999999999,2608
SUNSET COLOUR CHUNKY KNITTED THROW,881.4,2609
SILVER GLITTER FLOWER VOTIVE HOLDER,879.92,2610
S/2 ZINC HEART DESIGN PLANTERS,879.55,2611
BLACK PILLAR CANDLE SILVER FLOCK,877.8000000000001,2612
SET/3 POT PLANT CANDLES,877.1500000000001,2613
ROMANTIC IMAGES NOTEBOOK SET,876.75,2614
WALL ART THE MAGIC FOREST ,876.64,2615
FOLDING UMBRELLA CREAM POLKADOT,875.5,2616
RETRO PLASTIC POLKA TRAY,875.05,2617
WHITE CHRISTMAS TREE DECORATION ,874.8,2618
WHITE HEARTS WIRE PLANT POT HOLDER,873.5600000000001,2619
ENGLISH ROSE SCISSORS,871.4,2620
BLUE NEW BAROQUE CANDLESTICK CANDLE,870.95,2621
FRENCH BLUE METAL DOOR SIGN 4,870.57,2622
CLEAR MILKSHAKE GLASS,869.7,2623
MULTI HEARTS  STICKERS,869.3,2624
"BROCADE PURSE,SMALL ARCH BUTTON",867.55,2625
KITCHEN FLOWER POTS WALL PLAQUE,867.25,2626
WHITE HONEYCOMB PAPER GARLAND ,866.75,2627
CANDY HEART HANGING DECORATION,866.7099999999999,2628
PEG BAG APPLE DESIGN,866.7,2629
PINK AND WHITE CHRISTMAS TREE 120CM,866.58,2630
ASSTD DESIGN 3D PAPER STICKERS,866.53,2631
CERAMIC LOVE HEART MONEY BANK,866.5,2632
WRAP RED VINTAGE DOILY,866.0,2633
FELT FARM ANIMAL WHITE BUNNY ,865.7099999999999,2634
PARTY INVITES BALLOON GIRL,864.1999999999999,2635
FIRST CLASS PASSPORT COVER ,863.88,2636
CHRYSANTHEMUM POCKET BOOK ,863.5,2637
FRENCH LAVENDER SCENT HEART,861.3,2638
EMBROIDERED RIBBON REEL REBECCA ,860.88,2639
TRAVEL CARD WALLET SKULLS,860.4,2640
STRAWBERRIES  DESIGN FLANNEL ,859.64,2641
FRENCH CARRIAGE LANTERN,858.9000000000001,2642
CARD PARTY GAMES ,858.36,2643
BROWN  PIRATE TREASURE CHEST ,858.33,2644
PSYCHEDELIC WALL THERMOMETER,857.93,2645
BLACK EAR MUFF HEADPHONES,857.6,2646
PINK HAWAIIAN PICNIC HAMPER FOR 2,856.5,2647
RED DAISY POCKET BOOK ,856.23,2648
STAR  T-LIGHT HOLDER ,855.9999999999999,2649
CAKE SHOP  STICKER SHEET,854.99,2650
WALL ART WORK REST AND PLAY  ,853.47,2651
"DECORATION , HANGING METAL RABBIT",851.25,2652
ETCHED GLASS DROPLET DECORATION,851.23,2653
CANDY SHOP  STICKER SHEET,851.13,2654
JAZZ HEARTS MAGNETIC MEMO PAD,850.9000000000001,2655
BEADED CRYSTAL HEART PINK SMALL,850.35,2656
SMALL LICORICE DES PINK BOWL,850.2,2657
WHITE/BLUE PULL BACK RACING CAR,849.5,2658
FILIGREE WALL MIRROR  ANTIQUE WHITE,848.8,2659
MARAKESH LANTERN SMALL ,848.35,2660
FELT TOADSTOOL  SMALL,848.3,2661
RETROSPOT CANDLE  SMALL,847.88,2662
BLOSSOM IMAGES GIFT WRAP SET,846.0,2663
LARGE PINK GLASS SUNDAE DISH,845.86,2664
GIFT BAG PSYCHEDELIC APPLES,845.36,2665
BUFFALO BILL WALL ART ,845.22,2666
PINK JUICY FRUIT PHOTO FRAME,843.75,2667
GINGHAM OVEN GLOVE RED HEART ,843.75,2667
GREEN FERN NOTEBOOK,841.35,2669
VIPPASSPORT COVER ,840.6800000000001,2670
PINK 3 TIER GLASS PLATE STAND,840.45,2671
COLOURFUL FISHING GNOME,838.6,2672
JAM CLOCK MAGNET,838.47,2673
EDWARDIAN TOILET ROLL UNIT ,838.35,2674
SET OF 72 GREEN PAPER DOILIES,838.0999999999999,2675
CLOCK MAGNET MUM'S KITCHEN,837.88,2676
EAU DE NILE HEART SHAPE PHOTO FRAME,837.45,2677
MADRAS NOTEBOOK LARGE ,836.25,2678
DECORATION  BUTTERFLY  MAGIC GARDEN,836.18,2679
MA CAMPAGNE 4 DRAWER WALL SHELF,835.5500000000001,2680
GREEN GOOSE FEATHER CHRISTMAS TREE ,834.7500000000001,2681
CHRISTMAS CRAFT HEART DECORATIONS,834.0,2682
SET/9 CHRISTMAS T-LIGHTS SCENTED ,833.89,2683
PINK SWEETHEART BRACELET,833.75,2684
PARTY INVITES SPACEMAN,833.53,2685
TREASURE AHOY WALL ART,833.46,2686
BLACK RETRO BAR STOOL,830.9,2687
WHITE ADVENT CANDLE,829.08,2688
BLACK CHRISTMAS TREE 120CM,828.57,2689
DANISH ROSE TRINKET TRAYS,828.15,2690
BLUE JUICY FRUIT PHOTO FRAME,827.85,2691
RED SPOTTY PUDDING BOWL,827.04,2692
ASSORTED TUTTI FRUTTI BRACELET,826.99,2693
RIDGED GLASS STORAGE JAR CREAM LID,825.33,2694
SMALL PINK MAGIC CHRISTMAS TREE,825.03,2695
BEADED CRYSTAL HEART PINK LARGE,824.28,2696
FRENCH BLUE METAL DOOR SIGN 7,823.11,2697
PLAYING CARDS VINTAGE DOILY ,822.73,2698
KNITTED MUG COSY IVORY COLOUR ,821.7,2699
EGG FRYING PAN RED ,820.32,2700
WIRE EGG BASKET ,819.65,2701
MINI CAKE STAND T-LIGHT HOLDER,819.48,2702
FRENCH STYLE STORAGE JAR CAFE ,819.4599999999999,2703
RED DRAGONFLY HELICOPTER,818.85,2704
EASTER DECORATION SITTING BUNNY,817.9399999999999,2705
FRENCH BLUE METAL DOOR SIGN 6,816.82,2706
GREEN FERN POCKET BOOK,816.75,2707
SET/12 TAPER CANDLES,815.14,2708
WHITE STITCHED WALL CLOCK,814.4,2709
PINK SMALL GLASS CAKE STAND,814.05,2710
INLAID WOOD INCENSE HOLDER,813.09,2711
STRING OF STARS CARD HOLDER,812.2500000000001,2712
SHAKER THROW  QUILTED,811.8,2713
"BLACK TEA,COFFEE,SUGAR JARS",811.1999999999999,2714
KITTENS DESIGN FLANNEL,811.1,2715
LAVENDER SCENTED SET/9 T-LIGHTS,810.6999999999999,2716
JARDIN ETCHED GLASS LARGE BELL JAR,809.05,2717
BIRTHDAY PARTY CORDON BARRIER TAPE,807.52,2718
CONGRATULATIONS BUNTING,806.6,2719
SMALLFOLKART BAUBLE CHRISTMAS DEC,806.3399999999999,2720
CERAMIC BIRDHOUSE BLACK ROSE  LARGE,805.65,2721
BEADED CRYSTAL HEART GREEN LARGE,805.0500000000001,2722
BLACK STITCHED WALL CLOCK,804.65,2723
DECORATIVE HANGING SHELVING UNIT,799.3000000000001,2724
BLACK METAL BAROQUE PHOTO FRAME,798.75,2725
HORSE & PONY WALL ART,797.3100000000001,2726
SMALL BONNE JAM JAR  T-LIGHT HOLDER,795.6800000000001,2727
FRAPPUCINO SCARF KNITTING KIT,794.9300000000001,2728
RABBIT  DESIGN  COTTON TOTE BAG,794.25,2729
MOROCCAN BEATEN METAL DISH LARGE,793.74,2730
BLACK CHRISTMAS TREE 60CM,792.85,2731
BUNNY DECORATION MAGIC GARDEN,792.0699999999999,2732
PINK ROSE FABRIC MIRROR,791.72,2733
COLUMBIAN CANDLE RECTANGLE,791.25,2734
MIDNIGHT GLAMOUR SCARF KNITTING KIT,791.22,2735
FLOWERS  STICKERS,787.3599999999999,2736
SET/5 BLUE SPOTTY LID GLASS BOWLS,787.05,2737
BEACH HUT KEY CABINET,786.25,2738
CERAMIC STRAWBERRY TRINKET TRAY,784.2,2739
EASTER BUNNIES ON A STICK,783.96,2740
HANGING SPRING FLOWER EGG SMALL,783.8,2741
ZINC POLICE BOX LANTERN,783.7,2742
PACK OF 12 VINTAGE DOILY TISSUES,783.6899999999999,2743
WHITE GOOSE FEATHER TREE 60CM ,782.4,2744
RED HEART LUGGAGE TAG,781.47,2745
CHRISTMAS TREE DECORATION WITH BELL,781.1999999999999,2746
GLASS CHALICE BLUE SMALL ,780.3,2747
TRAVEL CARD WALLET PANTRY,779.9,2748
SCALLOP SHELL SOAP DISH,779.4,2749
BLUE DRAGONFLY HELICOPTER,779.1,2750
PANDA AND BUNNIES STICKER SHEET,778.5999999999999,2751
PINK STITCHED WALL CLOCK,778.07,2752
 NINE DRAWER OFFICE TIDY,777.9,2753
T-LIGHT HOLDER WHITE LACE,775.5699999999999,2754
REINDEER HEART DECORATION GOLD,774.4300000000001,2755
PINK YELLOW PATCH CUSHION COVER,774.15,2756
CERAMIC BIRDHOUSE BUTTERFLY LARGE,772.95,2757
WHITE BAROQUE WALL CLOCK ,772.65,2758
VINTAGE PINK DECORATIVE PARASOL,772.5,2759
SET/6 PINK BIRD T-LIGHT CANDLES,772.1899999999999,2760
CURIOUS IMAGES GIFT WRAP SET,772.1,2761
PHOTO FRAME LINEN AND LACE LARGE,771.72,2762
PINK 5 PATCH FLOWER CUSHION COVER ,769.65,2763
BAKING MOULD ROSE WHITE CHOCOLATE,766.88,2764
PIECE OF CAMO STATIONERY SET,766.09,2765
WHITE TRAVEL ALARM CLOCK,765.66,2766
GREEN METAL SWINGING BUNNY,765.28,2767
BLUE CHALET BIRDFEEDER,763.75,2768
DOLLY CABINET 3 DRAWERS ,762.4499999999999,2769
GIFT BAG BIRTHDAY,761.98,2770
WRAP ALPHABET POSTER  ,761.0,2771
SCOTTIE DOGS BABY BIB,760.14,2772
ASSTD MULTICOLOUR CIRCLES MUG,759.59,2773
LIPSTICK PEN BABY PINK,758.87,2774
PANTRY 3 HOOK ROLLING PIN HANGER,757.5,2775
WRAP BILLBOARD FONTS DESIGN,756.0,2776
EDWARDIAN 2 DRAWER WALL CABINET ,755.8,2777
BLUE 5 PATCH FLOWER CUSHION COVER,755.75,2778
EMBROIDERED RIBBON REEL CLAIRE,755.01,2779
LIBRARY LAMP,754.1999999999999,2780
SWEET HEART CAKE CARRIER,754.0,2781
VINTAGE BEAD PINK EVENING BAG,753.88,2782
SQUARE FLOOR CUSHION VINTAGE RED,753.2,2783
MINI JIGSAW DINOSAUR ,752.43,2784
APOTHECARY MEASURING JAR,751.4000000000001,2785
DECORATIVE PLANT POT WITH FRIEZE,751.2,2786
ASS COL LARGE SAND GECKO P'WEIGHT,750.63,2787
FLOWER FAIRY OIL BURNER SET ROSE,750.0,2788
DAISY NOTEBOOK ,749.85,2789
METAL SIGN CUPCAKE SINGLE HOOK,749.6,2790
CERAMIC LOVE HEARTS DESIGN MUG,749.47,2791
FRENCH BLUE METAL DOOR SIGN 8,749.32,2792
PINK BUTTERFLY WASHBAG,748.75,2793
ORIGAMI LAVENDER INCENSE/CANDL SET ,747.25,2794
ZINC HEARTS PLANT POT HOLDER,746.15,2795
SPOTS MUG,744.3,2796
URBAN CHIC CHOPSTICKS SET/5,744.15,2797
ASSORTED TUTTI FRUTTI KEYRING BALL,741.13,2798
TOYBOX  WRAP ,740.42,2799
SWISS CHALET TREE DECORATION ,737.66,2800
ANTIQUE EDWARDIAN DRESSER,737.4,2801
LILAC DIAMANTE PEN IN GIFT BOX,736.67,2802
PACK/12 XMAS FUN CARD,736.0000000000001,2803
RETROSPOT CANDLE  LARGE,735.82,2804
WHITE NEWBAROQUE CANDLESTICK CANDLE,734.25,2805
2 PICTURE BOOK EGGS EASTER CHICKS,732.5,2806
2 PICTURE BOOK EGGS EASTER BUNNY,732.5,2806
Adjustment by Peter on Jun 25 2010 ,731.0500000000001,2808
JIGSAW TREE WITH WATERING CAN,731.02,2809
RED POLKADOT COFFEE  MUG,730.9499999999999,2810
PINK GLASS CANDLEHOLDER,730.8500000000001,2811
ASS FLORAL PRINT TORCH,729.95,2812
CERAMIC BIRDHOUSE RED ROOF LARGE,729.85,2813
RETROSPOT CANDLE  MEDIUM,729.62,2814
RED RETROSPOT TAPE,727.44,2815
BLUE FLOCK GLASS CANDLEHOLDER,727.3299999999999,2816
GLASS CHALICE GREEN  LARGE ,726.6600000000001,2817
PINK HEARTS LIGHT CHAIN ,726.63,2818
MONEY BOX CONFECTIONERY DESIGN,726.35,2819
CHUNKY SILVER NECKLACE PASTEL FLOWE,726.3499999999999,2820
SQUARECUSHION COVER PINK UNION FLAG,725.8,2821
JASMINE VOTIVE CANDLE,725.12,2822
S/12 MINI RABBIT EASTER,724.9499999999999,2823
 PAINT YOUR OWN CANVAS SET,724.8,2824
EGG FRYING PAN IVORY ,722.5600000000001,2825
RETRO LAUNDRY TUB PISTACHIO,722.5,2826
DANISH ROSE DELUXE COASTER,722.5,2826
 HOME SWEET HOME  BLACKBOARD,722.3100000000001,2828
BISCUITS SMALL BOWL LIGHT BLUE,720.9399999999999,2829
FROG CANDLE,719.62,2830
ANIMAL STICKERS,718.47,2831
NEW BAROQUE JEWELLERY BOX ,717.3000000000001,2832
LARGE  TALL CAMPHOR WOOD TOADSTOOL ,717.15,2833
WHITE WITH BLACK CATS PLATE,716.23,2834
FRUIT TREE AND BIRDS WALL PLAQUE,715.35,2835
MINI PAINT SET VINTAGE  BOY+ GIRL,714.6,2836
SMALL KITCHEN FLOWER POTS PLAQUE,714.2,2837
ZINC HEART LATTICE PLANTER BOWL,713.8000000000001,2838
PINK PAINTED KASHMIRI CHAIR,713.4000000000001,2839
FOLKART HEART NAPKIN RINGS,713.3700000000001,2840
MEDIUM CHINESE STYLE SCISSOR,711.38,2841
GREEN SWEETHEART BRACELET,710.5,2842
PASTEL COLOUR HONEYCOMB FAN,709.89,2843
TRAVEL CARD WALLET FLOWER MEADOW,709.62,2844
SILVER FISHING GNOME ,709.3000000000001,2845
DAISY JOURNAL ,708.47,2846
FRENCH BLUE METAL DOOR SIGN 0,708.15,2847
BEADED CRYSTAL HEART BLUE  LARGE,707.86,2848
MOROCCAN BEATEN METAL DISH,707.8000000000001,2849
YELLOW SHARK HELICOPTER,707.5500000000001,2850
COCKTAIL SWORDS 50 PIECES,705.25,2851
FORKED CACTUS CANDLE,704.33,2852
EGG CUP MILKMAID INGRID,703.51,2853
COCKLE SHELL DISH,702.88,2854
SET/12 FUNKY FELT FLOWER PEG IN BAG,701.94,2855
HELLO SAILOR BLUE SOAP HOLDER,700.78,2856
MIRRORED WALL ART SKULLS,700.0,2857
"FRENCH BLUE METAL DOOR SIGN, 1",700.0,2857
SET/3 TALL GLASS CANDLE HOLDER PINK,699.7,2859
PLASMATRONIC LAMP,698.89,2860
LOVELY BONBON STICKER SHEET,698.8399999999999,2861
ABSTRACT CIRCLES NOTEBOOK,698.55,2862
FUNKY MONKEY MUG,697.9,2863
RIDGED GLASS FINGER BOWL,696.2099999999999,2864
FRENCH STYLE STORAGE JAR BONBONS,695.06,2865
SKULLS STORAGE BOX SMALL,694.5,2866
MIRROR MOSAIC CANDLE PLATE,694.26,2867
BLUE  SPOTTY PUDDING BOWL,694.08,2868
FLOWER FAIRY OIL BURNER SET SUMMER,693.25,2869
CANDY SPOT EGG WARMER HARE,692.74,2870
TUB 24 PINK FLOWER PEGS,691.35,2871
PAINTED BIRD ASSORTED CHRISTMAS,691.21,2872
SKULLS DESIGN FLANNEL,691.1999999999999,2873
MOTHER'S KITCHEN SPOON REST ,690.71,2874
CHRISTMAS TREE HANGING GOLD,690.64,2875
SILVER JEWELLED MIRROR TRINKET TRAY,689.49,2876
COLUMBIAN CANDLE ROUND,689.03,2877
BROWN FLOWER LIGHTS,688.95,2878
ALPHABET HEARTS STICKER SHEET,685.9499999999999,2879
GLASS BONBON JAR PARFUME AUX FLEURE,684.73,2880
SET OF 6 ICE CREAM SKITTLES,684.4000000000001,2881
VINTAGE LEAF CHOPPING BOARD  ,684.0,2882
RED APPLES CHOPPING BOARD   ,684.0,2882
SMALL SQUARE CUT GLASS CANDLESTICK,683.1,2884
"TUMBLER, NEW ENGLAND",683.04,2885
"BREAD BIN, DINER STYLE, IVORY",682.75,2886
ASS COL LARGE SAND FROG P'WEIGHT,682.32,2887
OLIVE CHALET BIRDFEEDER,681.25,2888
SMALL PINK GLASS SUNDAE DISH,680.91,2889
RIDGED GLASS PENDANT LAMPSHADE,680.8499999999999,2890
LARGE HEART FLOWERS HOOK   ,680.36,2891
PINK STRIPE HOT WATER BOTTLE,679.5500000000001,2892
SET OF 6 RIBBONS PERFECTLY PRETTY  ,678.27,2893
LA PALMIERA WALL THERMOMETER,677.4499999999999,2894
"FRENCH BOTTLE , LAVENDER",677.1,2895
S/4 BLACK DINNER CANDLE SILVER FLOC,676.71,2896
BLUE  DIAMANTE PEN IN GIFT BOX,675.75,2897
HELLO SAILOR BATHROOM SET,675.05,2898
SET/4 BADGES BEETLES,672.18,2899
RETRO SPOT CANDLE  LARGE,672.0,2900
FRENCH EMROIDR LAVENDER SCENT HEART,672.0,2900
S/2 BEACH HUT TREASURE CHESTS,671.65,2902
FOLKART BAUBLE CHRISTMAS DECORATION,671.51,2903
3 TRADITIONAL COOKIE CUTTERS  SET,671.4000000000001,2904
PINK PILLAR CANDLE SILVER FLOCK,670.28,2905
PINK GOOSE FEATHER TREE 60CM,670.25,2906
CHRISTMAS TREE HANGING SILVER ,670.11,2907
"CHARLIE+LOLA""EXTREMELY BUSY"" SIGN",669.8199999999999,2908
DRAWER KNOB VINTAGE GLASS BALL,669.61,2909
MINI  ZINC GARDEN DECORATIONS ,669.5799999999999,2910
DINOSAUR BIRTHDAY CARD,668.76,2911
PINK ROUND BUTTERFLY MIRROR ,667.83,2912
S/3 FLWR FAIRY LILLY CANDLES,666.9,2913
BROWN FURRY HOT WATER BOTTLE,665.05,2914
EGG CUP HENRIETTA HEN CREAM ,664.52,2915
PURPLE GREEN FLOWER PIGGY BANK,664.35,2916
2 PICTURE BOOK EGGS EASTER DUCKS,663.75,2917
SILVER SKULL HOT WATER BOTTLE ,662.61,2918
LARGE BONNE JAM JAR  T-LIGHT HOLDER,662.0600000000001,2919
PAPER BUNTING PAISLEY PARK,661.7,2920
STRAWBERRY SCENTED SET/9 T-LIGHTS,661.55,2921
WRAP FLOWER SHOP  ,661.5,2922
FLOWER FAIRY INCENSE ROSE,661.23,2923
FLOWER FAIRY SET 3 CANDLES LAVENDER,660.9,2924
BLUE GINGHAM ROSE CUSHION COVER,660.45,2925
S/4 PURPLE DINNER CANDLE BLK FLOCK,660.12,2926
RED VICTORIAN FABRIC OVAL BOX,659.87,2927
VINTAGE WOODEN PLATE RACK,659.1500000000001,2928
TRIPLE WIRE HOOK IVORY HEART,658.54,2929
PAPER LANTERN 7 POINT SNOW STAR,658.35,2930
SET/4 BADGES DOGS,658.31,2931
HEART EAR MUFF HEADPHONES,658.26,2932
RECTANGULAR SHAPED MIRROR,656.9,2933
BEACH HUT MIRROR,654.54,2934
LOUVRE VANITY MIRROR,653.85,2935
LARGE TORTILLA DESIGN RED BOWL,653.0999999999999,2936
PINK PATCH PENCIL CASE BLUE HEART,652.5300000000001,2937
VINTAGE BEAD PINK SHADE ,652.5,2938
PEARLISED IVORY HEART LARGE ,651.15,2939
HANGING BAUBLE T-LIGHT HOLDER LARGE,650.45,2940
SET/6 COLLAGE PAPER CUPS,650.4000000000001,2941
DECORATION  PINK CHICK MAGIC GARDEN,648.73,2942
WRAP FOLK ART,648.25,2943
LUNCHBAG SUKI  DESIGN ,648.25,2943
SCOTTIES CHILDRENS APRON,647.55,2945
VINTAGE SHELLS PRINT,647.45,2946
FRENCH CHATEAU SMALL FRUITBOWL,646.65,2947
PHOTO FRAME LINEN AND LACE SMALL,644.8000000000001,2948
GINGHAM HEART WREATH,644.8000000000001,2948
WALL ART HORSE & PONY ,644.6700000000001,2950
BOTANICAL ROSE GREETING CARD,644.64,2951
PACK OF 6 SMALL FRUIT STRAWS,644.58,2952
BUNNY WOODEN PAINTED WITH FLOWER ,644.52,2953
CUSHION COVER PINK UNION FLAG,643.35,2954
RUSTIC STRAWBERRY JAM POT SMALL,642.0,2955
WRAP DAISY CARPET ,640.95,2956
GLASS CHALICE GREEN  SMALL ,640.26,2957
SET OF 4 NAPKIN CHARMS CROWNS ,640.12,2958
BLACK BAROQUE WALL CLOCK ,639.6,2959
SILVER ROCOCO CANDLE STICK,638.0,2960
ROSE DU SUD OVEN GLOVE,637.3500000000001,2961
ROBIN CHRISTMAS CARD,635.22,2962
"BUNTING , SPOTTY ",634.7,2963
CURIOUS  IMAGES NOTEBOOK SET,634.25,2964
ROMANTIC IMAGES SCRAP BOOK SET,634.2,2965
ASS COL SMALL SAND GECKO P'WEIGHT,633.24,2966
CANDY BUTTON PHOTO ALBUM,631.25,2967
TEA TIME PAPER LANTERNS,630.5,2968
PINK PAINTED KASHMIRI TABLE,630.0,2969
SET OF 4 NAPKIN CHARMS 3 KEYS ,629.82,2970
PACK OF 12 PAISLEY PARK TISSUES ,629.4599999999999,2971
PINK OVAL JEWELLED MIRROR,629.25,2972
SMALL APOTHECARY MEASURING JAR ,629.05,2973
FLAG OF ST GEORGE ,628.65,2974
PIN CUSHION BABUSHKA PINK,627.2900000000001,2975
RED ORGANIC CANDLE IN GLASS,627.05,2976
WRAP BLUE RUSSIAN FOLKART,626.25,2977
STANDING FAIRY POLE SUPPORT ,626.13,2978
S/5 MINI ICE CREAM FRIDGE MAGNETS,625.1999999999999,2979
S/16 VINTAGE SKY BLUE CUTLERY,624.75,2980
TRAVEL CARD WALLET RETRO PETALS,623.94,2981
GINGHAM BABUSHKA DOORSTOP,623.86,2982
SMALL FOLKART STAR CHRISTMAS DEC,621.81,2983
FRENCH CHATEAU LARGE FRUIT BOWL ,621.75,2984
STRAWBRY SCENTED VOTIVE CANDLE,621.4499999999999,2985
CHERUB HEART DECORATION GOLD,620.45,2986
VINTAGE NOTEBOOK TRAVELOGUE,620.0500000000001,2987
CERAMIC PLATE LOVE HEART DESIGN,619.84,2988
PINK JEWELLED PHOTO FRAME ,618.1,2989
HOT WATER BOTTLE BABUSHKA LARGE,618.0,2990
"FRENCH BLUE METAL DOOR SIGN, 2",616.25,2991
SET/6 EAU DE NIL BIRD T-LIGHTS,615.83,2992
SMALL ORIENTAL BLUE FOLDING STOOL,615.4,2993
"FLOWER FAIRY,5 SUMMER B'DRAW LINERS",614.55,2994
IVORY HANGING BIRD PLANTER ,613.9499999999999,2995
VINTAGE NOTEBOOK PARIS DAYS,613.9,2996
CLAM SHELL SMALL ,613.69,2997
LAUREL HEART ANTIQUE GOLD,613.51,2998
RETROSPOT BABUSHKA DOORSTOP,613.37,2999
MAXWELL 2 TONE BLUE 60 PAGE PHOTO A,612.85,3000
FAIRY CAKE NOTEBOOK A5 SIZE,612.8499999999999,3001
VINTAGE BEAD PINK SCARF ,612.75,3002
OVAL  MINI PORTRAIT FRAME,611.85,3003
WHITE GLASS CHUNKY CHARM BRACELET,611.1,3004
FRENCH BLUE METAL DOOR SIGN 9,610.65,3005
VINTAGE JINGLE BELLS WREATH,610.5,3006
SCOTTIES DESIGN WASHBAG,610.35,3007
EDWARDIAN HEART PHOTO FRAME,610.0500000000001,3008
"WRAP, FRIENDSHIP ON GREEN",609.0,3009
PINK ENAMEL+GLASS HAIR COMB,609.0,3009
NEW BAROQUE IVORY CUSHION COVER ,607.7,3011
"FRENCH BLUE METAL DOOR SIGN, 3",607.5,3012
DAISY SKETCHBOOK ,606.86,3013
BLUE KNITTED HEN ,606.66,3014
3 RAFFIA RIBBONS VINTAGE CHRISTMAS,606.28,3015
RED REINDEER STRING OF 20 LIGHTS,605.75,3016
BLUE VICTORIAN FABRIC OVAL BOX,605.57,3017
YELLOW DRAGONFLY HELICOPTER,604.2,3018
SET OF 3 CHRISTMAS BRIAR CANDLES,602.85,3019
SMALL GREEN PEONY FOLDING STOOL,602.6,3020
MIRRORED WALL ART PHOTO FRAMES,602.25,3021
PANTRY APPLE CORER,601.9499999999999,3022
SET OF 36 SILVER PAPER DOILIES,601.75,3023
MIRROR LOVE BIRD T-LIGHT HOLDER,601.65,3024
MULTICOLOUR  CONFETTI IN TUBE,601.56,3025
SMALL TALL CAMPHOR WOOD TOADSTOOL,601.5,3026
ENVELOPE 50 ROMANTIC IMAGES,599.64,3027
RETRO SPOT CANDLE  SMALL,599.57,3028
BLACK SWEETHEART BRACELET,599.25,3029
DECORATIVE FLORE BATHROOM BOTTLE,598.91,3030
BLOSSOM IMAGES SCRAP BOOK SET,598.8,3031
SET OF PICTURE FRAME  STICKERS,598.59,3032
FOLDING BUTTERFLY MIRROR IVORY ,597.7800000000001,3033
DRAWER KNOB VINTAGE GLASS HEXAGON,596.96,3034
IVORY HANGING DECORATION  EGG,596.6899999999999,3035
SIX DRAWER OFFICE TIDY,596.0,3036
SET OF RED SALAD SERVERS ,596.0,3036
ELEPHANT TOY WITH BLUE T-SHIRT,595.68,3038
18PC WOODEN CUTLERY SET DISPOSABLE,595.15,3039
GOLD PHOTO FRAME,594.84,3040
BLUE CIRCLES DESIGN MONKEY DOLL,594.15,3041
SKULL LUNCHBOX WITH CUTLERY ,592.5,3042
SET/4 SCENTED CANDLES IN RAMEKINS,592.5,3042
BLUE PAINTED KASHMIRI CHAIR,591.5,3044
ORIGAMI JASMINE INCENSE/CANDLE SET,590.85,3045
ENVELOPE 50 CURIOUS IMAGES,590.11,3046
GRASS HOPPER WOODEN WALL CLOCK ,589.79,3047
BLACK MINI TAPE MEASURE ,588.0,3048
CHRISTMAS TREE T-LIGHT HOLDER,587.25,3049
LARGE APOTHECARY MEASURING JAR ,587.2,3050
ORIGAMI VANILLA INCENSE/CANDLE SET ,586.6,3051
POSY SHOPPER BAG,586.25,3052
"DECORATION , HANGING METAL CHICKEN",586.25,3052
EMBROIDERED RIBBON REEL RUBY ,585.63,3054
FLOWER FAIRY INCENSE BOUQUET,584.87,3055
SET/20 COLLAGE PAPER NAPKIN ,584.67,3056
LARGE SKULL WINDMILL,584.4000000000001,3057
BEACH HUT PHOTO FRAME,583.1,3058
CHRISTMAS CARD SCREEN PRINT ,583.08,3059
GREEN GOOSE FEATHER TREE 60CM,581.6999999999999,3060
ENAMEL PINK SUGAR CONTAINER,581.58,3061
ASSTD DESIGN POP ART SLIM PEN,581.4,3062
"FRENCH BLUE METAL DOOR SIGN, 5",581.25,3063
12 MINI TOADSTOOL PEGS,581.25,3063
BLUE PATCH PURSE PINK HEART,581.15,3065
MINI JIGSAW GO TO THE FAIR,580.74,3066
