Description,revenue,product_rank
BLACK AND WHITE DOG BOWL,3114.27,1238
NURSE'S BAG SOFT TOY,3112.5,1239
PINK SPOTS  WRAP ,3102.5,1240
GREEN CHERRY LIGHTS,3100.2000000000003,1241
EMERGENCY FIRST AID TIN ,3099.4,1242
BLACK AND WHITE CAT BOWL,3097.7999999999997,1243
RED SPOTTY OVEN GLOVE ,3095.44,1244
SET OF 60 VINTAGE LEAF CAKE CASES ,3091.6099999999997,1245
TOTE BAG I LOVE LONDON,3091.54,1246
JAZZ HEARTS PURSE NOTEBOOK,3069.62,1247
6 GIFT TAGS VINTAGE CHRISTMAS ,3068.82,1248
CERAMIC STRAWBERRY DESIGN MUG,3064.38,1249
ASSORTED CREEPY CRAWLIES,3059.95,1250
PACK OF 12 PINK SPOT TISSUES ,3058.93,1251
RED FLOWER CROCHET FOOD COVER,3057.89,1252
MAGIC DRAWING SLATE CIRCUS PARADE  ,3053.76,1253
SKULL DESIGN TV DINNER TRAY,3052.9,1254
SET OF 2 FANCY FONT TEA TOWELS,3042.3500000000004,1255
HEART SHAPED MIRROR,3041.07,1256
NO JUNK MAIL METAL SIGN,3040.07,1257
CLASSIC CAFE SUGAR DISPENSER,3037.1,1258
RETRO SPOT GIANT  TUBE MATCHES,3034.9500000000003,1259
MINT DINER WALL CLOCK,3034.5,1260
PEACE SMALL WOOD LETTERS,3031.65,1261
6 RIBBONS EMPIRE  ,3030.42,1262
BLACK AND WHITE PAISLEY FLOWER MUG,3019.57,1263
CINAMMON & ORANGE WREATH,3018.7,1264
16 PIECE CUTLERY SET PANTRY DESIGN,3018.2999999999997,1265
"FOLDING UMBRELLA , BLACK/BLUE  SPOT",3015.6,1266
TEA TIME TEA SET IN GIFT BOX,3006.2000000000003,1267
SOAP DISH BROCANTE,3002.9,1268
SET/3 DECOUPAGE STACKING TINS,2998.95,1269
3D VINTAGE CHRISTMAS STICKERS ,2995.59,1270
LOVE HEART NAPKIN BOX ,2993.0,1271
PINK SPOTTY CHILDS UMBRELLA,2991.25,1272
LOVE HEART SOCK HANGER,2990.1,1273
DOOR MAT AIRMAIL ,2988.53,1274
LARGE DECO JEWELLERY STAND,2977.8,1275
RED/WHITE SPOT PICNIC BAG,2974.45,1276
SWEETHEART CREAM STEEL TABLE RECT,2972.5499999999997,1277
SET OF 4 KNICK KNACK TINS LEAF,2970.85,1278
SPACEBOY BEAKER,2970.75,1279
BLUE OWL SOFT TOY,2968.05,1280
WATERING CAN GARDEN MARKER,2967.45,1281
MAGNETS PACK OF 4 VINTAGE COLLAGE,2962.81,1282
STRING OF 20 ROSE LIGHTS,2962.5,1283
PIZZA PLATE IN BOX,2957.3,1284
WHITE WICKER STAR ,2954.7000000000003,1285
GLASS APOTHECARY BOTTLE ELIXIR,2951.78,1286
UNION JACK FLAG PASSPORT COVER ,2947.02,1287
3 TRADITIONAl BISCUIT CUTTERS  SET,2946.92,1288
CLASSIC WHITE FRAME,2946.65,1289
MONEY BOX KINGS CHOICE DESIGN,2942.78,1290
DINOSAUR KEYRINGS ASSORTED,2940.0299999999997,1291
DOILEY STORAGE TIN,2934.98,1292
DOOR MAT FRIENDSHIP ,2934.31,1293
FAIRY SOAP SOAP HOLDER,2932.99,1294
RED DRAWER KNOB ACRYLIC EDWARDIAN,2918.71,1295
BLACK DINER WALL CLOCK,2918.05,1296
WHITE SWEETHEARTS CABINET 4 DRAWERS,2915.25,1297
GARLAND WITH HEARTS AND BELLS,2913.15,1298
ENAMEL FIRE BUCKET CREAM,2910.9300000000003,1299
SWEETHEART BIRD HOUSE,2908.55,1300
CHERRY CROCHET FOOD COVER,2905.27,1301
VINTAGE  2 METER FOLDING RULER,2902.4700000000003,1302
OFFICE MUG WARMER PINK,2899.5400000000004,1303
BLUE POLKADOT CUP,2898.75,1304
3D TRADITIONAL CHRISTMAS STICKERS,2893.04,1305
PIZZA SLICE DISH,2891.4500000000003,1306
RED RETROSPOT OVEN GLOVE DOUBLE,2890.2000000000003,1307
TOOL BOX SOFT TOY ,2889.64,1308
TREASURE TIN BUFFALO BILL ,2886.08,1309
RETROSPOT CIGAR BOX MATCHES ,2885.46,1310
BAG 500g SWIRLY MARBLES,2883.21,1311
12 IVORY ROSE PEG PLACE SETTINGS,2882.33,1312
RETROSPOT SMALL TUBE MATCHES,2881.65,1313
KITCHEN METAL SIGN,2879.3500000000004,1314
GIN & TONIC DIET GREETING CARD ,2868.66,1315
CHARLIE AND LOLA CHARLOTTE BAG,2864.05,1316
DRAWER KNOB CERAMIC IVORY,2863.39,1317
RED RETROSPOT PUDDING BOWL,2862.5,1318
HOME SWEET HOME CUSHION COVER ,2861.25,1319
SWEETHEART WIRE MAGAZINE RACK,2851.5,1320
TEA COSY RED  STRIPE,2850.93,1321
SANDALWOOD FAN,2848.9,1322
WHITE BELL HONEYCOMB PAPER ,2842.25,1323
METAL SHELF WITH RAIL ,2839.0,1324
DOLLY GIRL MINI BACKPACK,2838.9500000000003,1325
S/16 VINTAGE RED CUTLERY,2836.95,1326
DOORMAT VINTAGE LEAVES DESIGN ,2833.7,1327
PORCELAIN BUTTERFLY OIL BURNER,2832.8500000000004,1328
BRIGHT BLUES RIBBONS ,2826.39,1329
SMALL WHITE RETROSPOT MUG IN BOX ,2825.37,1330
CHERRY BLOSSOM DECORATIVE FLASK,2820.15,1331
STRAWBERRY HONEYCOMB  GARLAND ,2819.7,1332
MODERN FLORAL STATIONERY SET,2818.3,1333
ANGEL DECORATION 3 BUTTONS ,2816.16,1334
CHRISTMAS METAL POSTCARD WITH BELLS,2813.03,1335
TOILET SIGN OCCUPIED OR VACANT,2807.69,1336
ROBOT BIRTHDAY CARD,2806.0,1337
CHILDREN'S SPACEBOY MUG,2802.26,1338
"FOLDING UMBRELLA , RED/WHITE SPOT",2799.0,1339
TOAST ITS - BEST MUM,2797.25,1340
DECORATIVE WICKER HEART LARGE,2794.65,1341
WRAP I LOVE LONDON ,2787.68,1342
PINK PAISLEY QUILT ,2784.8,1343
"ELEPHANT, BIRTHDAY CARD, ",2782.92,1344
CARD DOLLY GIRL ,2777.73,1345
FLOWERS CHANDELIER T-LIGHT HOLDER,2770.91,1346
ENGLISH ROSE GARDEN SECATEURS,2769.64,1347
SET OF 3 RED STRIPE BASKETS,2769.44,1348
CHERRY BLOSSOM  DECORATIVE FLASK,2762.67,1349
VINTAGE UNION JACK PENNANT,2759.25,1350
SPACEBOY CHILDRENS BOWL,2757.15,1351
PINK  SPOTTY CUP,2756.7,1352
IVORY ENCHANTED FOREST PLACEMAT,2756.45,1353
 DOLLY GIRL BEAKER,2754.5,1354
6 GIFT TAGS 50'S CHRISTMAS ,2750.9300000000003,1355
BLUE GIANT GARDEN THERMOMETER,2743.77,1356
FRENCH TOILET SIGN BLUE METAL,2741.48,1357
RECYCLED ACAPULCO MAT BLUE,2741.35,1358
LADS ONLY TISSUE BOX,2741.16,1359
36 FOIL STAR CAKE CASES ,2740.04,1360
JAM JAR WITH GREEN LID,2733.6,1361
RED TEA TOWEL CLASSIC DESIGN,2730.56,1362
GLITTER HEART GARLAND WITH BELLS ,2724.71,1363
SET OF 4 DIAMOND NAPKIN RINGS,2722.47,1364
WRAP SUKI AND FRIENDS,2721.92,1365
"DECORATION HEN ON NEST, HANGING",2718.4500000000003,1366
CHOC TRUFFLE GOLD TRINKET POT ,2717.13,1367
5 HOOK HANGER MAGIC TOADSTOOL,2707.0499999999997,1368
LARGE RED BABUSHKA NOTEBOOK ,2703.73,1369
SALLE DE BAIN HOOK,2703.11,1370
BALLOONS  WRITING SET ,2691.4,1371
BUNDLE OF 3 SCHOOL EXERCISE BOOKS  ,2691.14,1372
SET OF 6 STRAWBERRY CHOPSTICKS,2682.79,1373
36 DOILIES DOLLY GIRL,2681.85,1374
RECIPE BOX RETRO SPOT DESIGN,2674.0000000000005,1375
WHITE BAMBOO RIBS LAMPSHADE,2672.85,1376
HEART GARLAND RUSTIC PADDED,2671.15,1377
METAL MEDINA LANTERN ,2670.6,1378
SET OF 4 ENGLISH ROSE COASTERS,2670.54,1379
COTTON APRON PANTRY DESIGN,2670.54,1379
SINGLE ANTIQUE ROSE HOOK IVORY,2669.95,1381
LARGE MEDINA STAMPED METAL BOWL ,2667.21,1382
DIAMANTE RING ASSORTED IN BOX.,2660.88,1383
LOVE HEART TRINKET POT,2654.64,1384
SET OF 16 VINTAGE ROSE CUTLERY,2649.8999999999996,1385
12 COLOURED PARTY BALLOONS,2637.85,1386
DINOSAURS  WRITING SET ,2635.99,1387
STOOL HOME SWEET HOME ,2635.9,1388
SMALL RED BABUSHKA NOTEBOOK ,2635.81,1389
COSMETIC BAG VINTAGE ROSE PAISLEY,2633.42,1390
RED ROCKING HORSE HAND PAINTED,2631.5,1391
JOY LARGE WOOD LETTERS,2631.35,1392
BLUE TEA TOWEL CLASSIC DESIGN,2627.09,1393
SMALL PURPLE BABUSHKA NOTEBOOK ,2624.6,1394
SMALL MARSHMALLOWS PINK BOWL,2623.46,1395
HANGING METAL BIRD BATH,2613.9,1396
VINTAGE KID DOLLY CARD ,2611.57,1397
MEDIUM MEDINA STAMPED METAL BOWL ,2607.7000000000003,1398
TEA PARTY  WRAPPING PAPER ,2603.0,1399
FRENCH KITCHEN SIGN BLUE METAL,2599.91,1400
FRENCH LAUNDRY SIGN BLUE METAL,2599.46,1401
"WALL MIRROR , DIAMANTE OVAL SHAPE",2591.85,1402
RECYCLED ACAPULCO MAT PINK,2589.9,1403
POTTING SHED CANDLE CITRONELLA,2588.27,1404
LUSH GREENS RIBBONS,2585.36,1405
CHARLIE & LOLA WASTEPAPER BIN FLORA,2583.5,1406
TV DINNER TRAY VINTAGE PAISLEY,2580.44,1407
5 HOOK BLACKBOARD ORGANISER ,2579.64,1408
REGENCY CAKE SLICE,2579.21,1409
SET OF 72 IVORY PAPER DOILIES,2578.2,1410
WICKER WREATH LARGE,2577.2599999999998,1411
BASKET OF TOADSTOOLS,2576.23,1412
BLACK WINE GLASS,2573.76,1413
CHARLIE AND LOLA TABLE TINS,2573.35,1414
SWALLOW GIANT TUBE MATCHES,2573.25,1415
STOP FOR TEA WALL ART,2572.7,1416
SET/6 FRUIT SALAD  PAPER PLATES,2572.3399999999997,1417
RIBBON REEL POLKADOTS ,2572.2,1418
CHRISTMAS CRAFT HEART STOCKING ,2566.0,1419
BABY BOOM RIBBONS ,2565.14,1420
REGENCY MIRROR WITH SHUTTERS,2565.0,1421
HEART WREATH DECORATION WITH BELL,2562.63,1422
SILVER BELLS TABLE DECORATION,2562.1,1423
GREEN DRAWER KNOB ACRYLIC EDWARDIAN,2561.46,1424
ROCKING HORSE GREEN CHRISTMAS ,2560.39,1425
KIDS RAIN MAC BLUE,2559.0299999999997,1426
BELLE JARDINIERE CUSHION COVER,2555.73,1427
BLUE SPOTS  WRAP,2555.0,1428
CHILDS GARDEN BRUSH PINK,2554.98,1429
AIRLINE BAG VINTAGE WORLD CHAMPION ,2554.08,1430
LARGE ROUND WICKER PLATTER ,2552.55,1431
BLUE  SPOTTY CUP,2542.23,1432
CALENDAR IN SEASON DESIGN,2541.6400000000003,1433
MULTICOLOUR SPRING FLOWER MUG,2539.31,1434
PORCELAIN T-LIGHT HOLDERS ASSORTED,2538.43,1435
"DOG BOWL , CHASING BALL DESIGN",2537.13,1436
PACK OF 12 RED RETROSPOT TISSUES ,2533.77,1437
CUPBOARD 3 DRAWER MA CAMPAGNE,2531.75,1438
HEART CALCULATOR,2531.53,1439
SET OF 3 WOODEN STOCKING DECORATION,2529.64,1440
TRIPLE HOOK ANTIQUE IVORY ROSE,2526.02,1441
WOOD STAMP SET THANK YOU,2525.87,1442
N0 SINGING METAL SIGN,2523.78,1443
RED LOVE HEART SHAPE CUP,2521.88,1444
WHITE TISSUE REAM,2520.15,1445
MAGIC SHEEP WOOL GROWING FROM PAPER,2516.75,1446
CHILDS GARDEN BRUSH BLUE,2515.38,1447
BAKING MOULD HEART MILK CHOCOLATE,2513.12,1448
SET 10 NIGHT OWL LIGHTS,2510.34,1449
SILVER PLATE CANDLE BOWL SMALL,2507.5000000000005,1450
CHILDRENS DOLLY GIRL MUG,2502.54,1451
IVORY WICKER HEART MEDIUM,2498.65,1452
SET OF 6 KASHMIR FOLKART BAUBLES,2493.75,1453
"SWISS ROLL TOWEL, CHOCOLATE  SPOTS",2493.3,1454
PLACE SETTING WHITE STAR,2493.11,1455
SKULLS WRITING SET ,2492.4,1456
TOMATO CHARLIE+LOLA COASTER SET,2488.8900000000003,1457
HOT BATHS SOAP HOLDER,2484.78,1458
RED/CREAM STRIPE FRINGE HAMMOCK,2483.75,1459
FRYING PAN PINK POLKADOT ,2483.0,1460
S/16 VINTAGE PISTACHIO CUTLERY,2482.0499999999997,1461
DOOR MAT RESPECTABLE HOUSE,2479.86,1462
PINK  POLKADOT CUP,2477.52,1463
GREEN GIANT GARDEN THERMOMETER,2474.6,1464
TOY TIDY DOLLY GIRL DESIGN,2474.38,1465
PENNY FARTHING BIRTHDAY CARD,2474.29,1466
ROSE 3 WICK MORRIS BOX CANDLE,2470.82,1467
PINK HEART DOTS HOT WATER BOTTLE,2466.87,1468
3D HEARTS  HONEYCOMB PAPER GARLAND,2463.6000000000004,1469
BATHROOM METAL SIGN ,2461.2999999999997,1470
SWALLOW WOODEN CHRISTMAS DECORATION,2456.77,1471
PINK FLOWER CROCHET FOOD COVER,2456.36,1472
DAISY GARDEN MARKER,2453.7,1473
PORCELAIN ROSE SMALL,2448.36,1474
HANGING PHOTO CLIP ROPE LADDER,2441.68,1475
RETRO SPOT STORAGE JAR,2439.09,1476
CARD MOTORBIKE SANTA,2438.4,1477
SET/4 SKULL BADGES,2437.4,1478
SILK PURSE BABUSHKA PINK,2437.08,1479
LUNCH BAG RED VINTAGE DOILY,2432.55,1480
6 ROCKET BALLOONS ,2431.95,1481
BLUE COAT RACK PARIS FASHION,2429.19,1482
PURPLE PAPER PARASOL,2428.5000000000005,1483
SET OF 2 TRAYS HOME SWEET HOME,2426.72,1484
FLUTED ANTIQUE CANDLE HOLDER,2421.25,1485
"SPRING DEC , HANGING CHICK CREAM",2419.2,1486
CABIN BAG VINTAGE PAISLEY,2417.15,1487
FLAMINGO LIGHTS,2416.85,1488
RIBBON REEL FLORA + FAUNA ,2411.87,1489
HANGING MEDINA LANTERN SMALL,2410.7000000000003,1490
GLITTER STAR GARLAND WITH BELLS ,2408.85,1491
CERAMIC PIRATE CHEST MONEY BANK,2403.45,1492
WALL ART 70'S ALPHABET ,2399.58,1493
SET/4 PINK ORCHID CANDLES IN BOWL,2397.78,1494
GLASS ETCHED T-LIGHT HOLDER LARGE,2397.3,1495
SET OF 3 WOODEN SLEIGH DECORATIONS,2396.7,1496
SMALL HAMMERED SILVER CANDLEPOT ,2387.1000000000004,1497
MILK PAN PINK RETROSPOT,2385.72,1498
SET OF 2 TINS JARDIN DE PROVENCE,2383.85,1499
BICYCLE SAFTEY WALL ART,2371.94,1500
CLASSIC FRENCH STYLE BASKET GREEN ,2368.1,1501
TEA FOR ONE POLKADOT,2362.0099999999998,1502
BAKING MOULD CHOCOLATE CUPCAKES,2358.89,1503
GENTLEMAN SHIRT REPAIR KIT ,2356.63,1504
LIPSTICK PEN RED,2350.86,1505
POTTING SHED ROSE CANDLE,2349.88,1506
GARLAND WITH STARS AND BELLS,2345.4,1507
"POPCORN HOLDER , SMALL ",2344.2999999999997,1508
SPACEBOY CHILDRENS CUP,2343.07,1509
EASTER CRAFT IVY WREATH WITH CHICK,2342.85,1510
JIGSAW TREE WITH BIRDHOUSE,2340.58,1511
S/15 SILVER GLASS BAUBLES IN BAG,2338.06,1512
DAISIES  HONEYCOMB GARLAND ,2337.9,1513
MINI JIGSAW CIRCUS PARADE ,2337.06,1514
T-LIGHT HOLDER HANGING LACE,2336.02,1515
BOMBS AWAY METAL SIGN,2332.7400000000002,1516
MISTLETOE HEART WREATH CREAM,2332.13,1517
APRON APPLE DELIGHT,2330.4,1518
200 RED + WHITE BENDY STRAWS,2325.86,1519
LARGE WHITE HONEYCOMB PAPER BELL  ,2323.7000000000003,1520
SET OF 2 ROUND TINS CAMEMBERT ,2322.3300000000004,1521
"FEATHER PEN,COAL BLACK",2321.47,1522
CARD CHRISTMAS VILLAGE,2319.48,1523
PINK DINER WALL CLOCK,2317.1,1524
HAPPY EASTER HANGING DECORATION,2314.41,1525
SET OF 6 T-LIGHTS CACTI ,2310.9300000000003,1526
BLUE/CREAM STRIPE FRINGE HAMMOCK,2307.8,1527
STAR DECORATION RUSTIC,2304.54,1528
PINK FELT EASTER EGG BASKET,2303.3,1529
PACK OF 20 SPACEBOY NAPKINS,2302.48,1530
TEA TIME MUG IN GIFT BOX,2300.9,1531
LARGE PURPLE BABUSHKA NOTEBOOK  ,2299.64,1532
SET OF 6 CAKE CHOPSTICKS,2298.31,1533
SET OF 4 NEW ENGLAND PLACEMATS,2298.0,1534
MEDINA STAMPED METAL STOOL,2296.9500000000003,1535
TRADITIONAL PICK UP STICKS GAME ,2295.0,1536
GARDENIA 1 WICK MORRIS BOXED CANDLE,2293.17,1537
PAPER CHAIN KIT LONDON,2292.9900000000002,1538
T-LIGHT HOLDER SWEETHEART HANGING,2292.09,1539
DISCO BALL CHRISTMAS DECORATION,2292.04,1540
PINK ROSE WASHBAG,2291.25,1541
SMALL SKULL WINDMILL,2289.03,1542
WOOD STOCKING CHRISTMAS SCANDISPOT,2282.2799999999997,1543
GREEN GINGHAM FLOWER JEWELLERY BOX,2281.7999999999997,1544
S/16 VINTAGE BLACK CUTLERY,2278.0499999999997,1545
SHOE SHINE BOX ,2275.25,1546
 50'S CHRISTMAS GIFT BAG LARGE,2272.25,1547
BAKING MOULD EASTER EGG MILK CHOC,2272.2000000000003,1548
ASSORTED TUTTI FRUTTI PEN,2270.85,1549
HEART MIRROR ANTIQUE WHITE,2269.14,1550
SWEETHEART WIRE WALL TIDY,2268.95,1551
BLUE DRAWER KNOB ACRYLIC EDWARDIAN,2266.68,1552
DISCO BALL ROTATOR BATTERY OPERATED,2265.5,1553
WALL ART DOG LICENCE ,2265.18,1554
SQUARE CHERRY BLOSSOM CABINET,2257.4,1555
SET OF 36 MUSHROOM PAPER DOILIES,2253.9,1556
OCEAN STRIPE HAMMOCK ,2253.3,1557
SET OF 12  VINTAGE POSTCARD SET,2250.87,1558
SET OF 10 LANTERNS FAIRY LIGHT STAR,2248.14,1559
SHELF WITH 4 HOOKS HOME SWEET HOME,2247.36,1560
VINTAGE BELLS GARLAND,2246.56,1561
KIDS RAIN MAC PINK,2245.68,1562
MAGIC DRAWING SLATE DINOSAUR,2244.3,1563
ANGEL DECORATION STARS ON DRESS,2243.22,1564
IVORY PILLAR CANDLE SILVER FLOCK,2242.84,1565
VINTAGE LEAF MAGNETIC NOTEPAD,2242.65,1566
CHOCOLATE 3 WICK MORRIS BOX CANDLE,2242.12,1567
4 PEAR BOTANICAL DINNER CANDLES,2241.25,1568
BUTTERFLIES  HONEYCOMB GARLAND,2240.25,1569
3 WHITE CHOC MORRIS BOXED CANDLES,2232.73,1570
EUCALYPTUS & PINECONE  WREATH,2232.7000000000003,1571
SET OF 4 NAPKIN CHARMS STARS   ,2230.7,1572
"NURSERY A,B,C PAINTED LETTERS",2230.15,1573
MAKE YOUR OWN PLAYTIME CARD KIT,2227.44,1574
PAINTED METAL HEART WITH HOLLY BELL,2224.24,1575
3 ROSE MORRIS BOXED CANDLES,2223.73,1576
CHARLIE+LOLA RED HOT WATER BOTTLE ,2223.32,1577
SMALL HANGING IVORY/RED WOOD BIRD,2222.99,1578
24 HANGING EASTER EGGS FLORAL TUB,2222.1,1579
PENS ASSORTED SPACEBALL,2221.1,1580
TEA CUP AND SAUCER RETRO SPOT,2218.98,1581
OVEN MITT APPLES DESIGN,2214.61,1582
CARD I LOVE LONDON ,2214.28,1583
GREEN ROSE WASHBAG,2212.5,1584
RED REFECTORY CLOCK ,2212.25,1585
CHRISTMAS HANGING TREE WITH BELL,2202.69,1586
HANGING MEDINA LANTERN LARGE,2201.25,1587
4 IVORY DINNER CANDLES SILVER FLOCK,2200.2,1588
CLASSIC BICYCLE CLIPS ,2200.1499999999996,1589
VINTAGE  2 METRE FOLDING RULER,2197.69,1590
CHARLIE & LOLA WASTEPAPER BIN BLUE,2194.75,1591
SWEETHEART CARRY-ALL BASKET,2194.7,1592
SILK PURSE BABUSHKA RED,2194.6,1593
3D CHRISTMAS STAMPS STICKERS ,2192.68,1594
EASTER TREE YELLOW BIRDS,2192.25,1595
IF YOU CAN'T STAND THE HEAT MUG,2191.75,1596
RECYCLED ACAPULCO MAT LAVENDER,2189.7,1597
DECORATIVE WICKER HEART MEDIUM,2181.19,1598
TOADSTOOL BEDSIDE LIGHT ,2180.7,1599
WOODLAND  STICKERS,2179.3199999999997,1600
WRAP CIRCUS PARADE,2178.84,1601
SWEETHEART 3 TIER CAKE STAND ,2174.1,1602
GLITTER CHRISTMAS STAR ,2173.7599999999998,1603
SET OF 6 3D KIT CARDS FOR KIDS,2172.13,1604
AIRLINE BAG VINTAGE JET SET BROWN,2171.25,1605
FELTCRAFT HAIRBAND PINK AND PURPLE,2170.1,1606
WATERMELON BATH SPONGE,2169.95,1607
TEATIME CAKE TIN WITH HANDLE,2168.5,1608
BLUE/BROWN DOTS RUFFLED UMBRELLA,2167.85,1609
SMALL SILVER TRELLIS CANDLEPOT,2165.3,1610
GIANT MEDINA STAMPED METAL BOWL ,2164.2,1611
WHITE BROCANTE SOAP DISH,2157.8500000000004,1612
SILVER MUG BONE CHINA TREE OF LIFE,2157.17,1613
RUSTIC MIRROR WITH LACE HEART,2155.51,1614
4 LAVENDER BOTANICAL DINNER CANDLES,2154.5,1615
HAND OPEN SHAPE DECO.WHITE,2154.2400000000002,1616
3 TIER SWEETHEART GARDEN SHELF,2153.9500000000003,1617
SET OF 3 WOODEN TREE DECORATIONS,2153.71,1618
EMPIRE TISSUE BOX,2152.81,1619
MINI JIGSAW DOLLY GIRL,2150.57,1620
72 CAKE CASES VINTAGE CHRISTMAS,2148.99,1621
HOME SWEET HOME KEY HOLDER,2148.54,1622
AIRLINE BAG VINTAGE JET SET WHITE,2148.09,1623
SET OF 6 GIRLS CELEBRATION CANDLES,2147.93,1624
RIBBON REEL SOCKS AND MITTENS,2146.38,1625
CHILDRENS GARDEN GLOVES PINK,2145.85,1626
3 GARDENIA MORRIS BOXED CANDLES,2145.11,1627
ANTIQUE ALL GLASS CANDLESTICK,2143.08,1628
CHILDRENS GARDEN GLOVES BLUE,2142.91,1629
MOBILE VINTAGE HEARTS ,2137.35,1630
BUTTERFLY CROCHET FOOD COVER,2136.67,1631
SUNSET CHECK HAMMOCK,2135.85,1632
SNOWFLAKE PORTABLE TABLE LIGHT ,2134.0400000000004,1633
WOODLAND ANIMAL  WRITING SET ,2133.05,1634
ICE CREAM BUBBLES,2131.0099999999998,1635
WRAP DOLLY GIRL,2130.0,1636
VINTAGE RED ENAMEL TRIM JUG ,2123.34,1637
SMALL PARISIENNE HEART PHOTO FRAME ,2122.67,1638
DANISH ROSE PHOTO FRAME,2122.61,1639
VANILLA INCENSE IN TIN,2122.19,1640
CUT GLASS T-LIGHT HOLDER OCTAGON,2118.21,1641
MONEY BOX BISCUITS DESIGN,2112.9,1642
GARDENIA 3 WICK MORRIS BOXED CANDLE,2112.17,1643
MEASURING TAPE BABUSHKA PINK,2111.3500000000004,1644
SET OF 12 LILY BOTANICAL T-LIGHTS,2110.65,1645
WRAP VINTAGE LEAF DESIGN,2109.42,1646
Adjustment by john on 26/01/2010 16,2107.41,1647
BLUE FELT EASTER EGG BASKET,2106.45,1648
WRAP POPPIES  DESIGN,2105.5,1649
CARD BILLBOARD FONT,2103.75,1650
KEY RING BASEBALL BOOT UNION JACK,2103.3,1651
GREEN CHRISTMAS TREE STRING 20LIGHT,2102.55,1652
ENGLISH ROSE TABLE CLOTH,2096.55,1653
FRYING PAN PINK POLKADOT,2094.29,1654
LARGE HANGING IVORY & RED WOOD BIRD,2092.23,1655
PAPER LANTERN 9 POINT DELUXE STAR,2091.55,1656
ROSE DES PADDED FLOOR CUSHION,2090.68,1657
SET 6 FOOTBALL CELEBRATION CANDLES,2087.77,1658
FRENCH ENAMEL POT W LID,2083.9100000000003,1659
LARGE CAKE TOWEL CHOCOLATE SPOTS,2082.15,1660
DOG LICENCE WALL ART,2081.64,1661
GREEN  SPOTTY PLATE ,2077.7999999999997,1662
PLAYING CARDS JUBILEE UNION JACK,2073.73,1663
EIGHT PIECE DINOSAUR SET,2072.71,1664
VILLAGE SHOW WALL ART,2072.42,1665
RAINY LADIES BIRTHDAY CARD,2069.53,1666
UNION JACK FLAG LUGGAGE TAG,2068.4,1667
VINTAGE CHRISTMAS GIFT BAG LARGE ,2066.65,1668
CARD CIRCUS PARADE,2066.43,1669
ASSORTED TUTTI FRUTTI NOTEBOOK,2062.2000000000003,1670
PORCELAIN ROSE LARGE ,2060.55,1671
DRAWER KNOB CRACKLE GLAZE GREEN,2060.4,1672
HANGING GLASS ETCHED TEALIGHT,2060.25,1673
CAKE PLATE LOVEBIRD PINK,2060.25,1673
CAT BOWL ,2057.7000000000003,1675
RED SPOTTY PURSE ,2051.9,1676
JAPANESE CROCHETED ANIMAL,2045.04,1677
STRIPEY CHOCOLATE NESTING BOXES,2036.8500000000001,1678
PINK FAIRY CAKE CUSHION COVER,2036.4,1679
PACK 20 DOLLY PEGS,2036.3999999999999,1680
RETRO SPOT SUGAR JAM BOWL,2034.75,1681
GLASS JAR MARMALADE ,2034.2900000000002,1682
EAU DE NIL DINER WALL CLOCK,2033.2,1683
CHRISTMAS HANGING HEART WITH BELL,2031.3899999999999,1684
HOME GARLAND PAINTED ZINC ,2029.2,1685
HERB MARKER BASIL,2027.0000000000002,1686
CHILDREN'S CIRCUS PARADE MUG,2026.78,1687
WHITE CHRISTMAS GARLAND STARS TREES,2025.45,1688
MAGNETS PACK OF 4 HOME SWEET HOME,2024.81,1689
HANGING RIDGE GLASS T-LIGHT HOLDER,2024.7,1690
FOLDING UMBRELLA  CHOC/WHITE  SPOT,2023.8,1691
 RED SPOT GIFT BAG LARGE,2023.5,1692
SPOTTY PINK DUCK DOORSTOP,2017.34,1693
TV DINNER TRAY AIR HOSTESS ,2017.33,1694
CARD BIRTHDAY COWBOY,2016.93,1695
BATH DUCK WATERING CAN,2016.5200000000002,1696
KEEP CALM WALL ART ,2015.97,1697
DOVE DECORATION PAINTED ZINC ,2014.76,1698
"FEATHER PEN,LIGHT PINK",2014.56,1699
EMBOSSED HEART 3 DRAWER SHELF,2012.85,1700
"SPRING DEC , HANGING CHICK  YELLOW",2009.8999999999999,1701
"CHRISTMAS GARLAND STARS,TREES",2008.75,1702
60 GOLD AND SILVER FAIRY CAKE CASES,2006.23,1703
RED SPOTTY BIG BOWL,2002.8000000000002,1704
CHERRY DESIGN PAPERLANTERNS,2000.44,1705
HANGING MINI COLOURED BOTTLES,1999.59,1706
PARTY CONES CANDY TREE DECORATION,1998.56,1707
IVORY SWEETHEART WIRE LETTER RACK ,1998.51,1708
SET/3 FLORAL GARDEN TOOLS IN BAG,1994.0,1709
SET/20 WOODLAND PAPER NAPKINS ,1990.53,1710
MEASURING TAPE BABUSHKA RED,1989.65,1711
CREAM SLICE FLANNEL CHOCOLATE SPOT ,1982.3000000000002,1712
KNEELING MAT HOUSEWORK  DESIGN,1980.71,1713
LETTER HOLDER HOME SWEET HOME,1980.31,1714
SET OF 2 CERAMIC CHRISTMAS REINDEER,1980.1799999999998,1715
CHILDS GARDEN SPADE BLUE,1978.68,1716
MORE BUTTER METAL SIGN ,1977.8500000000001,1717
4 LILY  BOTANICAL DINNER CANDLES,1970.0,1718
ASSORTED INCENSE PACK,1968.45,1719
DRAWER KNOB CRACKLE GLAZE PINK,1968.0,1720
GINGHAM RECIPE BOOK BOX,1966.95,1721
T-LIGHT HOLDER HANGING LOVE BIRD,1965.63,1722
GLASS  SONGBIRD STORAGE JAR,1965.3,1723
BAKING MOULD ROSE MILK CHOCOLATE,1964.25,1724
ICE CREAM DESIGN GARDEN PARASOL,1963.35,1725
ROLL WRAP 50'S RED CHRISTMAS ,1961.01,1726
SLEEPING CAT ERASERS,1959.3,1727
LE JARDIN BOTANIQUE CUSHION COVER,1948.23,1728
STORAGE TIN VINTAGE LEAF,1948.1,1729
FILIGREE HEART BUTTERFLY WHITE ,1947.06,1730
WHITE BELL HONEYCOMB PAPER GARLAND ,1946.55,1731
RED SPOT PAPER GIFT BAG,1944.08,1732
SKULLS GREETING CARD,1942.68,1733
VINTAGE RED ENAMEL TRIM MUG ,1940.45,1734
EMPIRE BIRTHDAY CARD,1939.47,1735
BLUE PADDED SOFT MOBILE,1938.25,1736
LOCAL CAFE MUG,1935.93,1737
BAKING MOULD TOFFEE CUP CHOCOLATE,1935.6000000000001,1738
SET 8 CANDLES VINTAGE DOILY,1932.0,1739
GREEN POLKADOT BOWL,1931.56,1740
KEY RING BASEBALL BOOT ASSORTED ,1928.8,1741
STAR WREATH DECORATION WITH BELL,1921.94,1742
PAINTED METAL STAR WITH HOLLY BELLS,1918.1599999999999,1743
IVORY EMBROIDERED QUILT ,1915.65,1744
WRAP DOILEY DESIGN,1915.5,1745
RED COAT RACK PARIS FASHION,1914.39,1746
RELAX LARGE WOOD LETTERS,1913.9,1747
SET 12 WILDFLOWER BOTANICAL T-LIGHT,1912.6000000000001,1748
CHILDS GARDEN SPADE PINK,1908.48,1749
BIRDHOUSE DECORATION MAGIC GARDEN,1906.69,1750
HANGING HEART WITH BELL,1906.58,1751
BLACK RETRODISC LAMPSHADE,1905.15,1752
YELLOW METAL CHICKEN HEART ,1903.05,1753
SKETCHBOOK MAGNETIC SHOPPING LIST,1900.9399999999998,1754
REGENCY CAKE FORK,1896.6,1755
ZINC T-LIGHT HOLDER STAR LARGE,1896.54,1756
EASTER TIN BUNNY BOUQUET,1895.4,1757
IVORY REFECTORY CLOCK,1894.6999999999998,1758
GLASS JAR PEACOCK BATH SALTS,1893.9800000000002,1759
WRAP 50'S  CHRISTMAS,1892.46,1760
PINK SPOTS CHOCOLATE NESTING BOXES ,1891.2,1761
MUSHROOM BLUE HOT WATER BOTTLE,1889.7500000000002,1762
12 PENCILS TALL TUBE POSY,1887.2899999999997,1763
PINK HAWAIIAN PICNIC HAMPER FOR 4,1883.55,1764
ENGLISH ROSE NOTEBOOK A7 SIZE,1881.58,1765
DOLLY GIRL CHILDRENS CUP,1880.1399999999999,1766
DOG BOWL VINTAGE CREAM,1878.42,1767
12 PENCILS TALL TUBE RED SPOTTY,1878.1899999999998,1768
SEWING SUSAN 21 NEEDLE SET,1875.5,1769
TRAVEL CARD WALLET VINTAGE TICKET,1875.12,1770
BAKING MOULD HEART WHITE CHOCOLATE,1873.51,1771
PINK DIAMANTE PEN IN GIFT BOX,1873.42,1772
STAR T-LIGHT HOLDER WILLIE WINKIE,1870.11,1773
HANGING JAM JAR T-LIGHT HOLDERS,1867.33,1774
CALENDAR FAMILY FAVOURITES,1865.88,1775
LARGE CHINESE STYLE SCISSOR,1864.75,1776
VINTAGE JINGLE BELLS HEART,1864.5,1777
STEEL SWEETHEART ROUND TABLE CREAM,1864.0,1778
DAIRY MAID  PUDDING BOWL,1860.0,1779
DOLLY GIRL CHILDRENS BOWL,1854.8500000000001,1780
SILK PURSE RUSSIAN DOLL RED,1854.25,1781
MONEY BOX POCKET MONEY DESIGN,1854.05,1782
SWEETHEART WIRE FRUIT BOWL,1853.1,1783
GREEN POLKADOT PLATE ,1852.9399999999998,1784
ALUMINIUM STAMPED HEART,1852.5500000000002,1785
CUT GLASS HEXAGON T-LIGHT HOLDER,1849.0,1786
IVORY PILLAR CANDLE GOLD FLOCK,1846.95,1787
CHILDS GARDEN TROWEL PINK,1846.32,1788
SET/6 WOODLAND PAPER CUPS,1843.1200000000001,1789
"AIRLINE LOUNGE,METAL SIGN",1840.91,1790
CHILDS GARDEN TROWEL BLUE ,1840.09,1791
ELEPHANT CARNIVAL POUFFE,1837.8999999999999,1792
LE GRAND TRAY CHIC SET,1837.5,1793
VINTAGE BILLBOARD MUG ,1836.16,1794
FRYING PAN RED RETROSPOT,1834.5,1795
4 VANILLA BOTANICAL CANDLES,1832.5,1796
HOT WATER BOTTLE SEX BOMB,1832.0,1797
SMALL DECO JEWELLERY STAND,1831.65,1798
ABSTRACT CIRCLE JOURNAL ,1831.2,1799
SILVER LATTICE VANILLA CANDLE POT,1830.03,1800
IVORY HANGING DECORATION  BIRD,1826.9299999999998,1801
PARTY INVITES WOODLAND,1824.32,1802
WICKER WREATH SMALL,1822.02,1803
PINK LOVE HEART SHAPE CUP,1819.9399999999998,1804
PARLOUR CERAMIC WALL HOOK,1819.25,1805
DOLLY MIXTURE CHILDREN'S UMBRELLA,1817.63,1806
SET/6 WOODLAND PAPER PLATES,1817.16,1807
GOLD  CHERRY LIGHTS,1817.0,1808
GREEN SPOTTY BOWL,1816.53,1809
CHILDS GARDEN FORK BLUE ,1815.1299999999999,1810
WOOD AND GLASS MEDICINE CABINET,1814.75,1811
BLACK ENCHANTED FOREST PLACEMAT,1813.35,1812
COSY SLIPPER SHOES LARGE GREEN,1803.9000000000003,1813
SET 12 COLOUR PENCILS SPACEBOY ,1803.3,1814
S/12 VANILLA  BOTANICAL T-LIGHTS,1802.6000000000001,1815
SMALL TAHITI BEACH BAG,1802.49,1816
SCENTED VELVET LOUNGE CANDLE ,1799.82,1817
BLUE FAIRY CAKE CHILD'S APRON,1792.6499999999999,1818
BOX OF 6 ASSORTED COLOUR TEASPOONS,1790.74,1819
SET OF 2 ROUND TINS DUTCH CHEESE,1790.5400000000002,1820
PINK JUMPER LARRY THE LAMB,1788.72,1821
JUNGLE POPSICLES ICE LOLLY HOLDERS,1788.15,1822
BABY MOUSE RED GINGHAM DRESS,1785.25,1823
CHILDS GARDEN FORK PINK,1783.4199999999998,1824
SWISS ROLL TOWEL PINK  SPOTS,1782.18,1825
STRAWBERRY DREAM CHILDS UMBRELLA,1781.0,1826
ZINC FINISH 15CM PLANTER POTS,1778.27,1827
PACK OF 12 BLUE PAISLEY TISSUES ,1776.84,1828
BLUE POT PLANT CANDLE ,1776.2500000000002,1829
SET 36 COLOUR PENCILS SPACEBOY ,1775.22,1830
WHITE RETRODISC LAMPSHADE,1775.1,1831
SET OF 16 VINTAGE PISTACHIO CUTLERY,1772.25,1832
TRAVEL CARD WALLET I LOVE LONDON,1767.72,1833
HANGING CHICK CREAM DECORATION,1766.1,1834
SET/20 FRUIT SALAD PAPER NAPKINS ,1764.3,1835
STAR DECORATION PAINTED ZINC ,1763.25,1836
BROCANTE SHELF WITH HOOKS,1762.9,1837
SET OF 6 FUNKY BEAKERS,1758.39,1838
DAIRY MAID BUTTER DISH,1758.25,1839
MEASURING TAPE RUSSIAN DOLL RED,1755.0500000000002,1840
ASSORTED ICE CREAM FRIDGE MAGNETS,1751.91,1841
DRAWER KNOB CRACKLE GLAZE BLUE,1751.79,1842
ASSORTED CAKES FRIDGE MAGNETS,1744.38,1843
FRENCH STYLE WALL DRESSER,1740.0,1844
WOODLAND STORAGE BOX LARGE ,1739.5400000000002,1845
12 PINK ROSE PEG PLACE SETTINGS,1733.58,1846
HAND OPEN SHAPE GOLD,1731.42,1847
EASTER TIN KEEPSAKE,1727.1,1848
