Description,revenue,product_rank
REGENCY CAKESTAND 3 TIER,277656.25,1
WHITE HANGING HEART T-LIGHT HOLDER,247048.01,2
"PAPER CRAFT , LITTLE BIRDIE",168469.6,3
Manual,151777.67,4
JUMBO BAG RED RETROSPOT,134307.44,5
POSTAGE,124648.04,6
ASSORTED COLOUR BIRD ORNAMENT,124351.86,7
PARTY BUNTING,103283.38,8
MEDIUM CERAMIC TOP STORAGE JAR,81416.73000000001,9
PAPER CHAIN KIT 50'S CHRISTMAS ,76598.18000000001,10
CHILLI LIGHTS,69084.3,11
JUMBO BAG STRAWBERRY,64127.77,12
BLACK RECORD COVER FRAME,63092.12,13
ROTATING SILVER ANGELS T-LIGHT HLDR,55880.17,14
WOOD BLACK BOARD ANT WHITE FINISH,54525.36,15
VINTAGE UNION JACK BUNTING,54432.62,16
EDWARDIAN PARASOL NATURAL,54332.61,17
JUMBO  BAG BAROQUE BLACK WHITE,52188.18,18
RABBIT NIGHT LIGHT,51251.24,19
HEART OF WICKER LARGE,49859.50000000001,20
RED HANGING HEART T-LIGHT HOLDER,48850.6,21
JUMBO STORAGE BAG SUKI,47760.99,22
CREAM HEART CARD HOLDER,47414.200000000004,23
EDWARDIAN PARASOL BLACK,45885.07,24
VICTORIAN GLASS HANGING T-LIGHT,45746.75,25
CHOCOLATE HOT WATER BOTTLE,45601.340000000004,26
JUMBO SHOPPER VINTAGE RED PAISLEY,45059.13,27
PAPER CHAIN KIT VINTAGE CHRISTMAS,44998.270000000004,28
VINTAGE UNION JACK MEMOBOARD,44785.83,29
PLEASE ONE PERSON METAL SIGN,44310.600000000006,30
JUMBO BAG PINK POLKADOT,43319.16,31
HEART OF WICKER SMALL,43316.54,32
JUMBO BAG PINK VINTAGE PAISLEY,43313.9,33
BAKING SET 9 PIECE RETROSPOT ,43070.91,34
RED RETROSPOT CAKE STAND,42862.74,35
SCOTTIE DOG HOT WATER BOTTLE,42463.200000000004,36
HOME BUILDING BLOCK WORD,42453.11,37
RED TOADSTOOL LED NIGHT LIGHT,41824.26,38
GIN + TONIC DIET METAL SIGN,40940.78,39
NATURAL SLATE HEART CHALKBOARD ,40276.170000000006,40
ROUND SNACK BOXES SET OF4 WOODLAND ,40219.82,41
DOORMAT UNION FLAG,40053.72,42
WOODEN FRAME ANTIQUE WHITE ,39909.170000000006,43
LUNCH BAG  BLACK SKULL.,39904.0,44
RED  HARMONICA IN BOX ,39870.65,45
COLOUR GLASS. STAR T-LIGHT HOLDER,39822.340000000004,46
STRAWBERRY CERAMIC TRINKET BOX,39682.67,47
PICNIC BASKET WICKER 60 PIECES,39619.5,48
COOK WITH WINE METAL SIGN ,37029.340000000004,49
WOODEN PICTURE FRAME WHITE FINISH,37011.1,50
LUNCH BAG CARS BLUE,36644.28,51
SET/4 WHITE RETRO STORAGE CUBES ,36259.65,52
SPACEBOY LUNCH BOX ,36150.99,53
DOORMAT KEEP CALM AND COME IN,35880.85,54
SPOTTY BUNTING,35509.55,55
CREAM SWEETHEART MINI CHEST,35264.729999999996,56
JUMBO BAG OWLS,35162.42,57
DOORMAT HEARTS,35069.4,58
HOT WATER BOTTLE TEA AND SYMPATHY,34479.62,59
JAM MAKING SET WITH JARS,33833.72,60
ROUND SNACK BOXES SET OF 4 FRUITS ,33670.240000000005,61
SET OF 3 CAKE TINS PANTRY DESIGN ,33298.3,62
LUNCH BAG WOODLAND,33004.76,63
SMALL POPCORN HOLDER,32505.93,64
ROSES REGENCY TEACUP AND SAUCER ,32470.65,65
LUNCH BAG RED RETROSPOT,32137.5,66
RED WOOLLY HOTTIE WHITE HEART.,31876.47,67
DOORMAT RED RETROSPOT,31864.2,68
LOVE BUILDING BLOCK WORD,31590.41,69
DOORMAT NEW ENGLAND,31461.34,70
DOLLY GIRL LUNCH BOX,30921.64,71
ALARM CLOCK BAKELIKE RED ,30703.09,72
HAND OVER THE CHOCOLATE   SIGN ,30615.930000000004,73
WOOD S/3 CABINET ANT WHITE FINISH,30363.75,74
LUNCH BAG SPACEBOY DESIGN ,30131.7,75
JUMBO BAG SPACEBOY DESIGN,29810.15,76
DOORMAT FANCY FONT HOME SWEET HOME,29691.95,77
DOORMAT FAIRY CAKE,29116.96,78
JUMBO BAG WOODLAND ANIMALS,29105.5,79
ASSORTED COLOURS SILK FAN,28766.32,80
PINK HAPPY BIRTHDAY BUNTING,28581.4,81
EDWARDIAN PARASOL RED,28557.920000000002,82
SET/5 RED SPOTTY LID GLASS BOWLS,28513.300000000003,83
WOOD 2 DRAWER CABINET WHITE FINISH,27952.22,84
RECYCLING BAG RETROSPOT ,27893.78,85
RETROSPOT TEA SET CERAMIC 11 PC ,27595.33,86
HAND WARMER OWL DESIGN,27514.63,87
BLACK HEART CARD HOLDER,27324.45,88
BOX OF VINTAGE ALPHABET BLOCKS,27251.26,89
LUNCH BAG RED SPOTTY,27237.6,90
RECIPE BOX PANTRY YELLOW DESIGN,27222.52,91
6 RIBBONS RUSTIC CHARM,27031.04,92
JUMBO BAG SCANDINAVIAN PAISLEY,26847.1,93
LUNCH BOX I LOVE LONDON,26596.719999999998,94
SET OF 3 REGENCY CAKE TINS,26566.280000000002,95
JUMBO BAG APPLES,26426.3,96
PACK OF 60 PINK PAISLEY CAKE CASES,26407.35,97
GUMBALL COAT RACK,26149.13,98
MINI PAINT SET VINTAGE ,25900.19,99
GRAND CHOCOLATECANDLE,25895.4,100
60 TEATIME FAIRY CAKE CASES,25785.92,101
SET 7 BABUSHKA NESTING BOXES,25620.99,102
ALARM CLOCK BAKELIKE GREEN,24898.96,103
JUMBO BAG PINK WITH WHITE SPOTS,24450.6,104
JUMBO BAG RED WHITE SPOTTY ,24323.85,105
HOT WATER BOTTLE KEEP CALM,24302.55,106
TEA TIME PARTY BUNTING,24255.3,107
FELTCRAFT 6 FLOWER FRIENDS,24248.29,108
DOOR MAT UNION FLAG,24216.23,109
JUMBO BAG ALPHABET,24160.44,110
IVORY KITCHEN SCALES,24137.48,111
WORLD WAR 2 GLIDERS ASSTD DESIGNS,24098.03,112
PINK CREAM FELT CRAFT TRINKET BOX ,23812.52,113
TEA TIME CAKE STAND IN GIFT BOX,23784.8,114
COLOUR GLASS T-LIGHT HOLDER HANGING,23598.510000000002,115
PINK BLUE FELT CRAFT TRINKET BOX,23554.3,116
BLUE HAPPY BIRTHDAY BUNTING,23531.47,117
GREEN REGENCY TEACUP AND SAUCER,23507.24,118
HAND WARMER SCOTTY DOG DESIGN,23436.660000000003,119
POPCORN HOLDER,23417.51,120
ZINC METAL HEART DECORATION,23331.43,121
FAIRY CAKE FLANNEL ASSORTED COLOUR,23322.620000000003,122
PLASTERS IN TIN SPACEBOY,23194.95,123
RETROSPOT HEART HOT WATER BOTTLE,23085.53,124
MEMO BOARD RETROSPOT  DESIGN,23083.44,125
PAPER CHAIN KIT EMPIRE,23049.95,126
REGENCY TEAPOT ROSES ,23033.52,127
HOT BATHS METAL SIGN,23010.120000000003,128
HANGING JAM JAR T-LIGHT HOLDER,22805.99,129
JUMBO STORAGE BAG SKULLS,22795.28,130
3 HEARTS HANGING DECORATION RUSTIC,22471.86,131
JAM MAKING SET PRINTED,22328.949999999997,132
HAND WARMER BIRD DESIGN,22168.33,133
SET OF TEA COFFEE SUGAR TINS PANTRY,22109.079999999998,134
NO SINGING METAL SIGN,22097.04,135
HANGING HEART JAR T-LIGHT HOLDER,22079.74,136
LUNCH BAG SUKI  DESIGN ,22026.4,137
PACK OF 72 RETRO SPOT CAKE CASES,21838.23,138
SWEETHEART CERAMIC TRINKET BOX,21793.25,139
FAWN BLUE HOT WATER BOTTLE,21779.5,140
SET/5 RED RETROSPOT LID GLASS BOWLS,21682.030000000002,141
PACK OF 72 RETROSPOT CAKE CASES,21551.8,142
ANTIQUE SILVER TEA GLASS ETCHED,21540.440000000002,143
SET OF 6 RIBBONS VINTAGE CHRISTMAS,21490.170000000002,144
3 HOOK PHOTO SHELF ANTIQUE WHITE,21458.42,145
HOT WATER BOTTLE I AM SO POORLY,21398.280000000002,146
ALARM CLOCK BAKELIKE PINK,21369.98,147
PAPER BUNTING WHITE LACE,21336.350000000002,148
CREAM CUPID HEARTS COAT HANGER,21256.0,149
ASSORTED COLOUR MINI CASES,21169.64,150
WOODEN ROUNDERS GARDEN SET ,20978.47,151
GREY HEART HOT WATER BOTTLE,20977.78,152
PLASTERS IN TIN CIRCUS PARADE ,20950.16,153
PAPER BUNTING RETROSPOT,20933.24,154
JUMBO BAG VINTAGE LEAF,20921.55,155
KNITTED UNION FLAG HOT WATER BOTTLE,20838.9,156
WOODEN CROQUET GARDEN SET,20813.809999999998,157
PAPER BUNTING RETRO SPOTS,20723.25,158
JUMBO BAG VINTAGE DOILY ,20641.4,159
SMALL GLASS HEART TRINKET POT,20588.260000000002,160
SET OF 6 SPICE TINS PANTRY DESIGN,20506.3,161
PLASTERS IN TIN WOODLAND ANIMALS,20471.68,162
PINK REGENCY TEACUP AND SAUCER,20329.640000000003,163
DOORMAT ENGLISH ROSE ,20298.8,164
JUMBO BAG TOYS ,20283.78,165
HOMEMADE JAM SCENTED CANDLES,20204.8,166
CERAMIC CAKE STAND + HANGING CAKES,20204.579999999998,167
VINTAGE SNAP CARDS,19957.34,168
PACK OF 6 BIRDY GIFT TAGS,19950.85,169
RETRO SPOT TEA SET CERAMIC 11 PC ,19921.27,170
HANGING HEART ZINC T-LIGHT HOLDER,19821.96,171
PAPER CHAIN KIT RETRO SPOT,19804.550000000003,172
BAKING SET SPACEBOY DESIGN,19719.21,173
HEART FILIGREE DOVE  SMALL,19686.6,174
CHRISTMAS LIGHTS 10 REINDEER,19590.9,175
FELTCRAFT DOLL MOLLY,19332.93,176
FELTCRAFT CUSHION RABBIT,19282.55,177
DOORMAT SPOTTY HOME SWEET HOME,19215.5,178
DOORMAT WELCOME PUPPIES,19178.67,179
RED KITCHEN SCALES,19149.63,180
VINTAGE HEADS AND TAILS CARD GAME ,19147.65,181
FELTCRAFT CUSHION OWL,19128.13,182
FELTCRAFT CUSHION BUTTERFLY,18865.21,183
METAL SIGN TAKE IT OR LEAVE IT ,18863.02,184
LADIES & GENTLEMEN METAL SIGN,18847.98,185
GROW A FLYTRAP OR SUNFLOWER IN TIN,18798.98,186
PICNIC BASKET WICKER LARGE,18794.25,187
15CM CHRISTMAS GLASS BALL 20 LIGHTS,18618.75,188
VINTAGE UNION JACK CUSHION COVER,18495.47,189
CLOTHES PEGS RETROSPOT PACK 24 ,18411.74,190
PACK OF 72 SKULL CAKE CASES,18319.18,191
WOODEN UNION JACK BUNTING,18251.280000000002,192
LUNCH BAG APPLE DESIGN,18220.5,193
LUNCH BAG PINK POLKADOT,18207.2,194
CHOCOLATE THIS WAY METAL SIGN,18041.24,195
SILVER HANGING T-LIGHT HOLDER,18001.35,196
CLASSIC METAL BIRDCAGE PLANT HOLDER,17888.71,197
WOODEN SCHOOL COLOURING SET,17861.22,198
POTTERING IN THE SHED METAL SIGN,17814.51,199
PLASTERS IN TIN STRONGMAN,17664.44,200
NATURAL SLATE CHALKBOARD LARGE ,17637.16,201
JUMBO BAG 50'S CHRISTMAS ,17636.04,202
ENAMEL FLOWER JUG CREAM,17471.23,203
RED RETROSPOT PICNIC BAG,17462.96,204
LARGE CAKE STAND  HANGING STRAWBERY,17354.85,205
FELTCRAFT BUTTERFLY HEARTS,17238.05,206
ANTIQUE SILVER TEA GLASS ENGRAVED,17162.93,207
WHITE SKULL HOT WATER BOTTLE ,16917.32,208
PAINTED METAL PEARS ASSORTED,16907.51,209
HAND WARMER UNION JACK,16857.36,210
TRADITIONAL MODELLING CLAY,16851.64,211
MULTI COLOUR SILVER T-LIGHT HOLDER,16833.35,212
JUMBO BAG DOILEY PATTERNS,16737.1,213
FAMILY ALBUM WHITE PICTURE FRAME,16676.94,214
MEMO BOARD COTTAGE DESIGN,16599.89,215
RED SPOTTY BISCUIT TIN,16431.45,216
BREAD BIN DINER STYLE IVORY,16335.789999999999,217
72 SWEETHEART FAIRY CAKE CASES,16178.47,218
RED RETROSPOT TRADITIONAL TEAPOT ,15892.74,219
HOME SWEET HOME METAL SIGN ,15888.490000000002,220
HEART IVORY TRELLIS SMALL,15836.59,221
ENAMEL BREAD BIN CREAM,15621.65,222
DOORMAT BLACK FLOCK ,15618.36,223
PLASTERS IN TIN VINTAGE PAISLEY ,15614.59,224
PAPER CHAIN KIT RETROSPOT,15411.86,225
HOME SWEET HOME MUG,15399.56,226
LUNCH BAG SUKI DESIGN ,15332.9,227
DOORMAT HOME SWEET HOME BLUE ,15329.57,228
WHITE METAL LANTERN,15309.64,229
LUNCH BAG DOLLY GIRL DESIGN,15305.19,230
HAND WARMER RED RETROSPOT,15272.520000000002,231
SINGLE HEART ZINC T-LIGHT HOLDER,15241.51,232
STRAWBERRY LUNCH BOX WITH CUTLERY,15232.34,233
HEART IVORY TRELLIS LARGE,15218.08,234
ANTIQUE SILVER T-LIGHT GLASS,15176.42,235
VINTAGE CREAM 3 BASKET CAKE STAND,15172.6,236
DOOR MAT RED SPOT,15093.48,237
"RECORD FRAME 7"" SINGLE SIZE ",15088.77,238
RETRO SPOT CAKE STAND,15083.449999999999,239
PINK 3 PIECE MINI DOTS CUTLERY SET,15067.14,240
WOODLAND CHARLOTTE BAG,15030.64,241
CHILDS BREAKFAST SET SPACEBOY ,15021.4,242
PICNIC BASKET WICKER SMALL,14945.6,243
TRAVEL SEWING KIT,14859.81,244
PACK OF 60 DINOSAUR CAKE CASES,14818.01,245
RED/WHITE DOTS RUFFLED UMBRELLA,14796.15,246
CHILDS BREAKFAST SET DOLLY GIRL ,14787.949999999999,247
SET/3 RED GINGHAM ROSE STORAGE BOX,14719.35,248
BLUE HARMONICA IN BOX ,14667.47,249
PICTURE FRAME WOOD TRIPLE PORTRAIT,14658.65,250
BROCADE RING PURSE ,14640.96,251
JUMBO BAG SCANDINAVIAN BLUE PAISLEY,14626.73,252
RED 3 PIECE MINI DOTS CUTLERY SET,14609.91,253
TRADITIONAL WOODEN SKIPPING ROPE,14603.13,254
AREA PATROLLED METAL SIGN,14563.100000000002,255
SET OF 20 KIDS COOKIE CUTTERS,14558.970000000001,256
RED RETROSPOT MINI CASES,14548.55,257
RED DINER WALL CLOCK,14527.09,258
RED RETROSPOT UMBRELLA,14439.12,259
WOODEN BOX OF DOMINOES,14430.66,260
VICTORIAN SEWING BOX LARGE,14406.63,261
WHITE WOOD GARDEN PLANT LADDER,14256.96,262
SET OF 4 PANTRY JELLY MOULDS,14151.42,263
SET OF 3 NOTEBOOKS IN PARCEL,14138.4,264
CHICK GREY HOT WATER BOTTLE,14071.27,265
BEWARE OF THE CAT METAL SIGN ,14070.08,266
SET OF 6 SOLDIER SKITTLES,13950.85,267
OPEN CLOSED METAL SIGN,13926.810000000001,268
LUNCH BAG PINK RETROSPOT,13893.7,269
SET OF 3 HEART COOKIE CUTTERS,13862.84,270
HOT WATER BOTTLE BABUSHKA ,13807.25,271
BLUE 3 PIECE MINI DOTS CUTLERY SET,13805.16,272
CHILDRENS CUTLERY POLKADOT PINK,13788.300000000001,273
WOODEN HAPPY BIRTHDAY GARLAND,13770.150000000001,274
WOODEN SKITTLES GARDEN SET,13722.74,275
SET OF 3 COLOURED  FLYING DUCKS,13577.15,276
DOORMAT 3 SMILEY CATS,13552.78,277
FELTCRAFT CHRISTMAS FAIRY,13462.18,278
RED SPOTTY ROUND CAKE TINS,13458.25,279
YOU'RE CONFUSING ME METAL SIGN ,13438.58,280
TEA TIME TEA TOWELS ,13363.35,281
PINK HEART SHAPE EGG FRYING PAN,13316.63,282
IVORY DINER WALL CLOCK,13271.9,283
FELTCRAFT DOLL ROSIE,13244.460000000001,284
PINK CHERRY LIGHTS,13198.1,285
HEART FILIGREE DOVE LARGE,13184.07,286
DOORMAT WELCOME TO OUR HOME,13103.81,287
SET/6 RED SPOTTY PAPER PLATES,13068.56,288
JUMBO BAG PEARS,13034.92,289
SET OF 10 LED DOLLY LIGHTS,12972.73,290
VINTAGE CHRISTMAS BUNTING,12960.12,291
LOVE HOT WATER BOTTLE,12954.75,292
CAKE STAND 3 TIER MAGIC GARDEN,12951.9,293
ALARM CLOCK BAKELIKE IVORY,12951.5,294
FILIGRIS HEART WITH BUTTERFLY,12849.14,295
METAL 4 HOOK HANGER FRENCH CHATEAU,12846.140000000001,296
ZINC FOLKART SLEIGH BELLS,12806.27,297
PINK PAPER PARASOL ,12803.78,298
TRADITIONAL KNITTING NANCY,12780.57,299
BAG 250g SWIRLY MARBLES,12750.539999999999,300
CHILDS BREAKFAST SET CIRCUS PARADE,12716.38,301
LUNCH BOX WITH CUTLERY RETROSPOT ,12669.04,302
WOODEN ADVENT CALENDAR CREAM,12588.449999999999,303
60 CAKE CASES VINTAGE CHRISTMAS,12556.77,304
VINTAGE RED KITCHEN CABINET,12550.0,305
CARRIAGE,12546.0,306
DOORMAT MULTICOLOUR STRIPE,12541.22,307
DOOR MAT NEW ENGLAND,12520.95,308
3 STRIPEY MICE FELTCRAFT,12515.65,309
SAVE THE PLANET MUG,12515.44,310
GARDENERS KNEELING PAD KEEP CALM ,12463.78,311
SOMBRERO ,12413.8,312
VICTORIAN SEWING BOX SMALL ,12409.960000000001,313
FELTCRAFT PRINCESS CHARLOTTE DOLL,12407.83,314
WHITE SPOT RED CERAMIC DRAWER KNOB,12354.22,315
DOORMAT TOPIARY,12345.7,316
PHOTO FRAME CORNICE,12280.18,317
CHARLOTTE BAG SUKI DESIGN,12268.65,318
MINT KITCHEN SCALES,12219.99,319
COFFEE MUG APPLES DESIGN,12179.95,320
LARGE CIRCULAR MIRROR MOBILE,12173.5,321
VINTAGE SNAKES & LADDERS,12157.97,322
SET OF 2 WOODEN MARKET CRATES,12146.25,323
SWEETHEART CAKESTAND 3 TIER,12130.4,324
SET OF 20 VINTAGE CHRISTMAS NAPKINS,12124.119999999999,325
BLUE STRIPE CERAMIC DRAWER KNOB,12115.210000000001,326
BLACK/BLUE DOTS RUFFLED UMBRELLA,12089.2,327
ANTIQUE LILY FAIRY LIGHTS,12081.0,328
RED RETROSPOT CHARLOTTE BAG,12034.8,329
LUNCH BAG ALPHABET DESIGN,11994.41,330
RED RETROSPOT ROUND CAKE TINS,11983.6,331
DOORMAT AIRMAIL ,11946.53,332
PLASTERS IN TIN SKULLS,11913.75,333
RED RETROSPOT SMALL MILK JUG,11908.05,334
DOTCOM POSTAGE,11906.36,335
BREAD BIN DINER STYLE RED ,11879.06,336
BINGO SET,11877.45,337
EDWARDIAN PARASOL PINK,11872.810000000001,338
SET OF 3 BUTTERFLY COOKIE CUTTERS,11818.65,339
"ASSORTED FLOWER COLOUR ""LEIS""",11759.77,340
PACK OF 6 PANNETONE GIFT BOXES,11725.48,341
DOORMAT UNION JACK GUNS AND ROSES,11722.24,342
 WHITE CHERRY LIGHTS,11697.300000000001,343
STRAWBERRY CHARLOTTE BAG,11654.8,344
DOUGHNUT LIP GLOSS ,11615.7,345
DELUXE SEWING KIT ,11611.27,346
REGENCY SUGAR BOWL GREEN,11567.24,347
RETROSPOT CHILDRENS APRON,11562.369999999999,348
HANGING METAL HEART LANTERN,11530.56,349
3 TIER CAKE TIN RED AND CREAM,11467.38,350
RED STRIPE CERAMIC DRAWER KNOB,11446.75,351
CANDLEHOLDER PINK HANGING HEART,11400.75,352
BLUE DINER WALL CLOCK,11358.78,353
TEA TIME KITCHEN APRON,11321.320000000002,354
SET/20 RED SPOTTY PAPER NAPKINS ,11310.21,355
FRYING PAN UNION FLAG,11283.86,356
DOORMAT RESPECTABLE HOUSE,11282.69,357
SET/20 RED RETROSPOT PAPER NAPKINS ,11229.27,358
CERAMIC STRAWBERRY CAKE MONEY BANK,11187.26,359
RIBBON REEL STRIPES DESIGN ,11166.78,360
RED FLORAL FELTCRAFT SHOULDER BAG,11155.41,361
BOX OF VINTAGE JIGSAW BLOCKS ,11129.42,362
FELTCRAFT PRINCESS LOLA DOLL,11094.51,363
PHARMACIE FIRST AID TIN,11093.9,364
PAPER BUNTING COLOURED LACE,11086.900000000001,365
RED SPOT HEART HOT WATER BOTTLE,11031.1,366
WHITE SPOT BLUE CERAMIC DRAWER KNOB,11022.43,367
SET OF 36 TEATIME PAPER DOILIES,11012.88,368
GROW YOUR OWN PLANT IN A CAN ,10976.56,369
PLACE SETTING WHITE HEART,10910.31,370
PINK PARTY BAGS,10841.48,371
COFFEE MUG CAT + BIRD DESIGN,10831.29,372
CIRCUS PARADE LUNCH BOX ,10791.83,373
SET/6 PINK  BUTTERFLY T-LIGHTS,10779.640000000001,374
RED SPOT CERAMIC DRAWER KNOB,10762.47,375
SET OF 72 PINK HEART PAPER DOILIES,10729.4,376
WOODEN BOX ADVENT CALENDAR ,10710.1,377
PINK FAIRY CAKE CHILDRENS APRON,10704.21,378
RECIPE BOX RETROSPOT ,10702.150000000001,379
FIRST AID TIN,10675.6,380
SET3 BOOK BOX GREEN GINGHAM FLOWER ,10667.05,381
36 DOILIES VINTAGE CHRISTMAS,10590.4,382
STRAWBERRY FAIRY CAKE TEAPOT,10577.95,383
STRAWBERRY   PICNIC BAG,10572.95,384
PACK OF 12 LONDON TISSUES ,10519.359999999999,385
PACK OF 60 SPACEBOY CAKE CASES,10465.49,386
CHRISTMAS LIGHTS 10 VINTAGE BAUBLES,10432.08,387
SET OF 72 RETRO SPOT PAPER  DOILIES,10423.199999999999,388
RED RETROSPOT MUG,10415.650000000001,389
SOLDIERS EGG CUP ,10415.22,390
PARTY METAL SIGN ,10392.72,391
PIGGY BANK RETROSPOT ,10377.02,392
POTTING SHED TEA MUG,10353.86,393
DOOR MAT FAIRY CAKE,10347.72,394
LUNCH BAG VINTAGE DOILY ,10347.66,395
AGED GLASS SILVER T-LIGHT HOLDER,10338.6,396
ADVENT CALENDAR GINGHAM SACK,10338.230000000001,397
LUNCH BAG DOILEY PATTERN ,10323.05,398
FULL ENGLISH BREAKFAST PLATE,10321.92,399
FAMILY PHOTO FRAME CORNICE,10310.19,400
I'M ON HOLIDAY METAL SIGN,10306.150000000001,401
ALARM CLOCK BAKELIKE ORANGE,10300.44,402
NATURAL SLATE RECTANGLE CHALKBOARD,10285.61,403
DOORSTOP RETROSPOT HEART,10283.5,404
SET/10 RED POLKADOT PARTY CANDLES,10238.49,405
BABUSHKA LIGHTS STRING OF 10,10229.64,406
FELTCRAFT DOLL EMILY,10227.310000000001,407
JUMBO BAG DOLLY GIRL DESIGN,10206.78,408
SET OF 72 RETROSPOT PAPER  DOILIES,10177.119999999999,409
REGENCY TEA PLATE ROSES ,10170.99,410
DOOR MAT SPOTTY HOME SWEET HOME,10121.69,411
CHILDRENS APRON SPACEBOY DESIGN,10120.289999999999,412
COFFEE MUG PEARS  DESIGN,10043.41,413
VINTAGE UNION JACK DOORSTOP,9987.98,414
T-LIGHT GLASS FLUTED ANTIQUE,9985.630000000001,415
GLITTER BUTTERFLY CLIPS,9951.0,416
LUNCH BAG VINTAGE LEAF DESIGN,9950.35,417
GARDENERS KNEELING PAD CUP OF TEA ,9933.69,418
RED GINGHAM ROSE JEWELLERY BOX,9907.5,419
BLUE SPOT CERAMIC DRAWER KNOB,9894.93,420
10 COLOUR SPACEBOY PEN,9878.1,421
DOOR MAT 3 SMILEY CATS,9861.69,422
CHILDRENS CUTLERY POLKADOT BLUE,9827.25,423
CAMOUFLAGE LED TORCH,9797.310000000001,424
PACK OF 12 SUKI TISSUES ,9774.279999999999,425
4 TRADITIONAL SPINNING TOPS,9763.68,426
HAND WARMER BABUSHKA DESIGN,9747.83,427
JUMBO BAG VINTAGE CHRISTMAS ,9742.1,428
 SET 2 TEA TOWELS I LOVE LONDON ,9726.85,429
DOOR MAT HEARTS,9715.06,430
ICE CREAM SUNDAE LIP GLOSS,9638.16,431
UNION STRIPE WITH FRINGE  HAMMOCK,9624.04,432
CHILDRENS CUTLERY RETROSPOT RED ,9603.68,433
LONDON BUS COFFEE MUG,9582.150000000001,434
VICTORIAN SEWING BOX MEDIUM,9550.49,435
SET/6 RED SPOTTY PAPER CUPS,9513.300000000001,436
SMALL CHINESE STYLE SCISSOR,9512.68,437
GINGERBREAD MAN COOKIE CUTTER,9497.91,438
SWEETHEART RECIPE BOOK STAND,9465.55,439
ROSE COTTAGE KEEPSAKE BOX ,9409.199999999999,440
"SET 3 RETROSPOT TEA,COFFEE,SUGAR",9376.67,441
SET OF 36 PAISLEY FLOWER DOILIES,9374.96,442
GLITTER HANGING BUTTERFLY STRING,9350.39,443
S/6 WOODEN SKITTLES IN COTTON BAG,9347.16,444
DOOR MAT ENGLISH ROSE ,9343.43,445
ENCHANTED BIRD COATHANGER 5 HOOK,9326.33,446
PINK DOUGHNUT TRINKET POT ,9302.1,447
VINTAGE BLUE KITCHEN CABINET,9290.0,448
RED RETROSPOT JUMBO BAG ,9289.35,449
WELCOME  WOODEN BLOCK LETTERS,9289.2,450
POLKADOT PEN,9276.83,451
SET OF 4 KNICK KNACK TINS DOILY ,9237.3,452
PINK BABY BUNTING,9236.86,453
WHITE WIRE EGG HOLDER,9227.800000000001,454
PINK 3 PIECE POLKADOT CUTLERY SET,9227.380000000001,455
ROUND CAKE TIN VINTAGE RED,9211.630000000001,456
REGENCY TEA PLATE GREEN ,9184.9,457
PANTRY ROLLING PIN,9180.53,458
BATH BUILDING BLOCK WORD,9164.78,459
WICKER STAR ,9115.800000000001,460
CALENDAR PAPER CUT DESIGN,9110.29,461
BLACK/BLUE POLKADOT UMBRELLA,9085.49,462
WASHROOM METAL SIGN,9080.01,463
TOY TIDY SPACEBOY  ,9044.0,464
TRIPLE PHOTO FRAME CORNICE ,9035.63,465
COFFEE MUG DOG + BALL DESIGN,9021.390000000001,466
LARGE POPCORN HOLDER ,9006.2,467
REGENCY MILK JUG PINK ,8995.0,468
SET 10 LIGHTS NIGHT OWL,8990.800000000001,469
GAOLERS KEYS DECORATIVE GARDEN ,8980.54,470
TWO DOOR CURIO CABINET,8960.1,471
REVOLVER WOODEN RULER ,8944.439999999999,472
CHRISTMAS LIGHTS 10 SANTAS ,8912.95,473
ENAMEL MEASURING JUG CREAM,8867.29,474
SET/3 RUSSIAN DOLL STACKING TINS,8864.300000000001,475
TEA TIME TABLE CLOTH,8852.880000000001,476
FOOD CONTAINER SET 3 LOVE HEART ,8846.17,477
PAPER BUNTING VINTAGE PAISLEY,8842.150000000001,478
VINYL RECORD FRAME SILVER,8831.2,479
TRADITIONAL WOODEN CATCH CUP GAME ,8814.42,480
PICTURE DOMINOES,8813.74,481
PINK FLORAL FELTCRAFT SHOULDER BAG,8796.77,482
CHRISTMAS CRAFT LITTLE FRIENDS,8790.7,483
FUNKY DIVA PEN,8672.109999999999,484
SET/2 RED RETROSPOT TEA TOWELS ,8670.710000000001,485
SKULL LUNCH BOX WITH CUTLERY ,8643.6,486
MA CAMPAGNE CUTLERY BOX,8609.25,487
TOY TIDY PINK POLKADOT,8587.48,488
RED 3 PIECE RETROSPOT CUTLERY SET,8574.54,489
VINTAGE DOILY JUMBO BAG RED ,8508.22,490
JUMBO BAG PAISLEY PARK,8498.04,491
RETROSPOT PARTY BAG + STICKER SET,8497.18,492
RED SPOTTY CHARLOTTE BAG,8468.4,493
WOODEN ADVENT CALENDAR RED,8459.95,494
PACK OF 12 HEARTS DESIGN TISSUES ,8441.64,495
MOROCCAN TEA GLASS,8407.609999999999,496
TOY TIDY PINK RETROSPOT  ,8393.1,497
ALARM CLOCK BAKELIKE CHOCOLATE,8367.84,498
BOX OF 6 MINI VINTAGE CRACKERS,8345.43,499
NOEL WOODEN BLOCK LETTERS ,8343.19,500
IVORY HANGING DECORATION  HEART,8324.58,501
LIGHT PINK CHERRY LIGHTS,8311.0,502
SET 2 PANTRY DESIGN TEA TOWELS,8310.17,503
RED RETROSPOT BUTTER DISH,8297.55,504
AFGHAN SLIPPER SOCK PAIR,8251.15,505
FOLKART ZINC HEART CHRISTMAS DEC,8229.67,506
SWEETHEART KEY CABINET,8201.7,507
ENGLISH ROSE HOT WATER BOTTLE,8191.91,508
BOX OF 6 MINI 50'S CRACKERS,8169.4800000000005,509
VICTORIAN  METAL POSTCARD SPRING,8155.09,510
LARGE WHITE HEART OF WICKER,8137.500000000001,511
VINTAGE CREAM DOG FOOD CONTAINER,8122.35,512
SET 6 PAPER TABLE LANTERN HEARTS ,8110.68,513
RAIN PONCHO RETROSPOT,8096.48,514
SET OF 2 TEA TOWELS APPLE AND PEARS,8091.740000000001,515
ICE CREAM PEN LIP GLOSS ,8077.31,516
PACK 3 BOXES CHRISTMAS PANNETONE,8066.599999999999,517
12 PENCILS SMALL TUBE SKULL,8049.15,518
RECIPE BOX WITH METAL HEART,8046.150000000001,519
KINGS CHOICE BISCUIT TIN,8044.09,520
PINK VINTAGE PAISLEY PICNIC BAG,8034.86,521
CAKE STAND WHITE TWO TIER LACE,8007.3,522
CHILDRENS CUTLERY SPACEBOY ,7966.08,523
FELTCRAFT PRINCESS OLIVIA DOLL,7965.29,524
VINTAGE POST OFFICE CABINET,7954.87,525
RED METAL BOX TOP SECRET,7920.78,526
CLEAR DRAWER KNOB ACRYLIC EDWARDIAN,7917.11,527
RED WHITE SCARF  HOT WATER BOTTLE,7914.150000000001,528
SUKI  SHOULDER BAG,7898.07,529
RETRO COFFEE MUGS ASSORTED,7897.5,530
BLUE 3 PIECE POLKADOT CUTLERY SET,7889.360000000001,531
RED/WHITE DOT MINI CASES,7859.75,532
MINI WOODEN HAPPY BIRTHDAY GARLAND,7845.81,533
DOOR MAT WELCOME PUPPIES,7835.1,534
SET/10 RED SPOTTY PARTY CANDLES,7826.91,535
SET/10 PINK POLKADOT PARTY CANDLES,7807.610000000001,536
BOYS VINTAGE TIN SEASIDE BUCKET,7744.58,537
RIBBON REEL LACE DESIGN ,7739.6,538
WHITE DOVE HONEYCOMB PAPER GARLAND,7729.05,539
RED SPOTTY SHOPPER BAG,7711.95,540
RIBBON REEL HEARTS DESIGN ,7670.64,541
RETROSPOT LARGE MILK JUG,7592.85,542
GLASS  BEURRE DISH,7590.450000000001,543
HAND WARMER RED LOVE HEART,7574.1,544
GIRLS VINTAGE TIN SEASIDE BUCKET,7566.87,545
RETRO SPOT LARGE MILK JUG,7561.6,546
CHRISTMAS TOILET ROLL,7534.29,547
GIN AND TONIC MUG,7509.76,548
SET 6 SCHOOL MILK BOTTLES IN CRATE,7495.29,549
PHOTO FRAME 3 CLASSIC HANGING,7484.4,550
KINGS CHOICE MUG,7450.17,551
ROUND SNACK BOXES SET OF 4 SKULLS,7440.6,552
SCANDINAVIAN REDS RIBBONS,7427.48,553
CREAM SWEETHEART WALL CABINET,7417.26,554
DOOR MAT FANCY FONT HOME SWEET HOME,7415.39,555
FOUR HOOK  WHITE LOVEBIRDS,7412.31,556
ROUND CONTAINER SET OF 5 RETROSPOT,7408.75,557
LAUNDRY 15C METAL SIGN,7401.59,558
FAIRY TALE COTTAGE NIGHTLIGHT,7389.599999999999,559
RED RETROSPOT PEG BAG,7382.05,560
SET/3 VANILLA SCENTED CANDLE IN BOX,7364.91,561
LARGE HEART MEASURING SPOONS,7357.47,562
SET 3 WICKER LOG BASKETS,7320.15,563
WEEKEND BAG VINTAGE ROSE PAISLEY,7315.95,564
SCANDINAVIAN PAISLEY PICNIC BAG,7260.76,565
SET/2 RED SPOTTY TEA TOWELS ,7225.150000000001,566
POPPY'S PLAYHOUSE KITCHEN,7192.01,567
RED RETROSPOT SUGAR JAM BOWL,7179.0,568
RECIPE BOX BLUE SKETCHBOOK DESIGN,7172.81,569
TRADITIONAL CHRISTMAS RIBBONS,7171.83,570
DOORMAT MERRY CHRISTMAS RED ,7171.64,571
NOVELTY BISCUITS CAKE STAND 3 TIER,7164.469999999999,572
RETRO SPOT TRADITIONAL TEAPOT ,7149.0,573
GINGHAM HEART  DOORSTOP RED,7146.39,574
SET OF 4 KNICK KNACK TINS DOILEY ,7132.7,575
I CAN ONLY PLEASE ONE PERSON MUG,7124.67,576
SET OF 4 KNICK KNACK TINS LONDON ,7116.65,577
PACK OF 60 MUSHROOM CAKE CASES,7073.63,578
SET OF 6 T-LIGHTS SANTA,7053.760000000001,579
PICNIC BOXES SET OF 3 RETROSPOT ,7051.25,580
MIRRORED DISCO BALL ,7051.150000000001,581
DOORMAT RED SPOT,7050.21,582
 SPACEBOY BABY GIFT SET,7048.549999999999,583
SET/6 TURQUOISE BUTTERFLY T-LIGHTS,7035.59,584
LOVEBIRD HANGING DECORATION WHITE ,7009.55,585
BOX OF 24 COCKTAIL PARASOLS,6964.39,586
AIRLINE BAG VINTAGE TOKYO 78,6962.4800000000005,587
FANCY FONTS BIRTHDAY WRAP,6957.0,588
JINGLE BELL HEART ANTIQUE SILVER,6955.8,589
LANTERN CREAM GAZEBO ,6932.82,590
DOOR MAT BLACK FLOCK ,6922.9,591
LAVENDER SCENTED FABRIC HEART,6920.43,592
GIANT 50'S CHRISTMAS CRACKER,6907.5199999999995,593
CREAM SWEETHEART LETTER RACK,6897.62,594
PACK OF 12 TRADITIONAL CRAYONS,6889.77,595
6 EGG HOUSE PAINTED WOOD,6881.6900000000005,596
PACK OF 12 PINK PAISLEY TISSUES ,6880.0,597
SMALL FAIRY CAKE FRIDGE MAGNETS,6875.0,598
HOLIDAY FUN LUDO,6869.0,599
PACK OF 12 WOODLAND TISSUES ,6855.19,600
POPPY'S PLAYHOUSE BEDROOM ,6820.150000000001,601
GIRAFFE WOODEN RULER,6816.839999999999,602
CHARLOTTE BAG PINK POLKADOT,6812.09,603
SET/10 PINK SPOTTY PARTY CANDLES,6807.88,604
SMALL WHITE HEART OF WICKER,6798.1,605
GREEN 3 PIECE MINI DOTS CUTLERY SET,6762.54,606
5 HOOK HANGER RED MAGIC TOADSTOOL,6757.95,607
HAPPY STENCIL CRAFT,6756.4,608
ROSE CARAVAN DOORSTOP,6753.91,609
VINTAGE DOILY TRAVEL SEWING KIT,6736.2,610
PACK 3 BOXES BIRD PANNETONE ,6735.95,611
SET 6 PAPER TABLE LANTERN STARS ,6735.88,612
CREAM SWEETHEART TRAYS,6734.5,613
MINI CAKE STAND  HANGING STRAWBERY,6731.23,614
CARDHOLDER HOLLY WREATH METAL,6730.6,615
CUPCAKE LACE PAPER SET 6,6722.629999999999,616
BATHROOM METAL SIGN,6683.860000000001,617
SET 40 HEART SHAPE PETIT FOUR CASES,6677.0,618
COLOURING PENCILS BROWN TUBE,6661.2300000000005,619
HANGING METAL STAR LANTERN,6656.83,620
PAPER CHAIN KIT SKULLS ,6651.900000000001,621
RED RETROSPOT SHOPPER BAG,6647.31,622
